Label,Message,Message_Length,Word_Count,Sentence_Count,Transformed_Message,Clean_Length
ham,"HI HUN! IM NOT COMIN 2NITE-TELL EVERY1 IM SORRY 4 ME, HOPE U AVA GOODTIME!OLI RANG MELNITE IFINK IT MITE B SORTED,BUT IL EXPLAIN EVERYTHIN ON MON.L8RS.x",152,27,3,hi hun im comin nitetel everi im sorri hope u ava goodtimeoli rang melnit ifink mite b sortedbut il explain everythin monlrsx,125
spam,Please CALL 08712402779 immediately as there is an urgent message waiting for you,81,13,1,pleas call immedi urgent messag wait,36
ham,Yeah like if it goes like it did with my friends imma flip my shit in like half an hour,87,20,1,yeah like goe like friend imma flip shit like half hour,55
ham,Mum say we wan to go then go... Then she can shun bian watch da glass exhibition... ,84,17,7,mum say wan go go shun bian watch da glass exhibit,50
ham,What your plan for pongal?,26,5,1,plan pongal,11
ham,Just wait till end of march when el nino gets himself. Oh.,58,12,3,wait till end march el nino get oh,34
ham,"Not yet chikku..going to room nw, i'm in bus..",46,9,5,yet chikkugo room nw im bu,26
ham,Am also doing in cbe only. But have to pay.,43,10,3,also cbe pay,12
ham,Honey boo I'm missing u.,24,5,2,honey boo im miss u,19
ham,"We have sent JD for Customer Service cum Accounts Executive to ur mail id, For details contact us",97,18,1,sent jd custom servic cum account execut ur mail id detail contact us,69
ham,"Yo, I'm at my parents' gettin cash. Good news: we picked up a downstem",70,14,2,yo im parent gettin cash good news pick downstem,48
ham,"Thank you so much. When we skyped wit kz and sura, we didnt get the pleasure of your company. Hope you are good. We've given you ultimatum oh! We are countin down to aburo. Enjoy!",179,35,5,thank much skype wit kz sura didnt get pleasur compani hope good weve given ultimatum oh countin aburo enjoy,108
spam,"Hungry gay guys feeling hungry and up 4 it, now. Call 08718730555 just 10p/min. To stop texts call 08712460324 (10p/min)",120,20,3,hungri gay guy feel hungri call pmin stop text call pmin,56
ham,Ok. No wahala. Just remember that a friend in need ...,54,11,6,ok wahala rememb friend need,28
ham,I will see in half an hour,26,7,1,see half hour,13
ham,"Im in inperialmusic listening2the weirdest track ever byåÓleafcutter johnåÓ-sounds like insects being molested&someone plumbing,remixed by evil men on acid!",156,19,1,im inperialmus listeningth weirdest track ever byåóleafcutt johnåósound like insect molestedsomeon plumbingremix evil men acid,126
ham,\Hey sorry I didntgive ya a a bellearlier hunny,47,9,1,hey sorri didntgiv ya bellearli hunni,37
ham,SERIOUSLY. TELL HER THOSE EXACT WORDS RIGHT NOW.,48,8,3,serious tell exact word right,29
spam,Can U get 2 phone NOW? I wanna chat 2 set up meet Call me NOW on 09096102316 U can cum here 2moro Luv JANE xx Callså£1/minmoremobsEMSPOBox45PO139WA,147,27,1,u get phone wanna chat set meet call u cum moro luv jane xx callså£minmoremobsemspoboxpowa,90
ham,"Tee hee. Off to lecture, cheery bye bye.",40,8,3,tee hee lectur cheeri bye bye,29
ham,"Sorry chikku, my cell got some problem thts y i was nt able to reply u or msg u..",81,19,3,sorri chikku cell got problem tht nt abl repli u msg u,54
ham,If you still havent collected the dough pls let me know so i can go to the place i sent it to get the control number,116,26,1,still havent collect dough pl let know go place sent get control number,71
ham,Ok...,5,1,4,ok,2
spam,network operator. The service is free. For T & C's visit 80488.biz,66,12,4,network oper servic free cs visit biz,37
ham,Let me know how to contact you. I've you settled in a room. Lets know you are ok.,81,18,4,let know contact ive settl room let know ok,43
ham,Wot u up 2 u weirdo?,20,6,1,wot u u weirdo,14
ham,Can do lor...,13,3,4,lor,3
ham,Dont put your phone on silent mode ok,37,8,1,dont put phone silent mode ok,29
ham,Can i meet Ì_ at 5.. As 4 where depends on where Ì_ wan 2 in lor..,66,17,5,meet ì depend ì wan lor,23
ham,Waiting 4 my tv show 2 start lor... U leh still busy doing ur report?,69,15,4,wait tv show start lor u leh still busi ur report,49
ham,Oh ho. Is this the first time u use these type of words,55,13,2,oh ho first time u use type word,32
ham,Am I the only one who doesn't stalk profiles?,45,9,1,one doesnt stalk profil,23
ham,"Ever green quote ever told by Jerry in cartoon \A Person Who Irritates u Always Is the one Who Loves u Vry Much But Fails to Express It...!..!! :-) :-) gud nyt""",160,32,6,ever green quot ever told jerri cartoon person irrit u alway one love u vri much fail express gud nyt,101
ham,Yes i thought so. Thanks.,25,5,3,ye thought thank,16
ham,But if she.s drinkin i'm ok.,28,6,3,she drinkin im ok,17
ham,"Just wondering, the others just took off",40,7,1,wonder other took,17
ham,"Night has ended for another day, morning has come in a special way. May you smile like the sunny rays and leaves your worries at the blue blue bay. Gud mrng",156,31,3,night end anoth day morn come special way may smile like sunni ray leav worri blue blue bay gud mrng,100
ham,"What do you do, my dog ? Must I always wait till the end of your day to have word from you ? Did you run out of time on your cell already?",138,33,1,dog must alway wait till end day word run time cell alreadi,59
ham,Happy new year to u too!,24,6,1,happi new year u,16
ham,"Hey...Great deal...Farm tour 9am to 5pm $95/pax, $50 deposit by 16 May",70,12,7,heygreat dealfarm tour pm pax deposit may,41
ham,Eat jap done oso aft ur lect wat... ÌÏ got lect at 12 rite... ,62,14,7,eat jap done oso aft ur lect wat ìï got lect rite,49
ham,"Hey babe! I saw you came online for a second and then you disappeared, what happened ?",86,17,1,hey babe saw came onlin second disappear happen,47
ham,Da my birthdate in certificate is in april but real date is today. But dont publish it. I shall give you a special treat if you keep the secret. Any way thanks for the wishes,174,35,4,da birthdat certif april real date today dont publish shall give special treat keep secret way thank wish,105
ham,Happy birthday... May all ur dreams come true...,48,8,7,happi birthday may ur dream come true,37
ham,Aiyah u did ok already lar. E nydc at wheellock?,48,10,2,aiyah u ok alreadi lar e nydc wheellock,39
ham,TELL HER I SAID EAT SHIT.,25,6,2,tell said eat shit,18
ham,Sure! I am driving but will reach my destination soon.,54,10,2,sure drive reach destin soon,28
ham,"K so am I, how much for an 8th? Fifty?",38,10,1,k much th fifti,15
ham,Your daily text from me ÛÒ a favour this time,46,10,1,daili text ûò favour time,26
ham,Great to hear you are settling well. So what's happenin wit ola?,64,12,2,great hear settl well what happenin wit ola,43
ham,Those cocksuckers. If it makes you feel better ipads are worthless garbage novelty items and you should feel bad for even wanting one,133,23,2,cocksuck make feel better ipad worthless garbag novelti item feel bad even want one,83
ham,I tot u reach liao. He said t-shirt.,36,8,3,tot u reach liao said tshirt,28
ham,"FRAN I DECIDED 2 GO N E WAY IM COMPLETELY BROKE AN KNACKERED I GOT UP BOUT 3 C U 2MRW LOVE JANX P.S THIS IS MY DADS FONE, -NO CREDIT",132,31,2,fran decid go n e way im complet broke knacker got bout c u mrw love janx ps dad fone credit,92
ham,Your right! I'll make the appointment right now.,48,8,2,right ill make appoint right,28
ham,Designation is software developer and may be she get chennai:),62,10,1,design softwar develop may get chennai,38
spam,Enjoy the jamster videosound gold club with your credits for 2 new videosounds+2 logos+musicnews! get more fun from jamster.co.uk! 16+only Help? call: 09701213186 ,163,23,3,enjoy jamster videosound gold club credit new videosound logosmusicnew get fun jamstercouk help call,100
spam,"Get 3 Lions England tone, reply lionm 4 mono or lionp 4 poly. 4 more go 2 www.ringtones.co.uk, the original n best. Tones 3GBP network operator rates apply",155,28,6,get lion england tone repli lionm mono lionp poli go origin n best tone gbp network oper rate appli,99
ham,I jokin oni lar.. ÌÏ busy then i wun disturb Ì_.,48,11,4,jokin oni lar ìï busi wun disturb ì,35
ham,"Ok, be careful ! Don't text and drive !",39,9,1,ok care dont text drive,23
ham,"I.ll always be there, even if its just in spirit. I.ll get a bb soon. Just trying to be sure i need it.",103,23,6,ill alway even spirit ill get bb soon tri sure need,51
ham,U r too much close to my heart. If u go away i will be shattered. Plz stay with me.,83,20,4,u r much close heart u go away shatter plz stay,47
ham,I love u 2 babe! R u sure everything is alrite. Is he being an idiot? Txt bak girlie,84,19,2,love u babe r u sure everyth alrit idiot txt bak girli,54
ham,How abt making some of the pics bigger?,39,8,1,abt make pic bigger,19
ham,Got but got 2 colours lor. One colour is quite light n e other is darker lor. Actually i'm done she's styling my hair now.,122,25,4,got got colour lor one colour quit light n e darker lor actual im done she style hair,85
ham,"Whenevr ur sad, Whenevr ur gray, Remembr im here 2 listn 2 watevr u wanna say, Jus walk wid me a little while,&amp; I promise I'll bring back ur smile.:-)",154,30,2,whenevr ur sad whenevr ur gray remembr im listn watevr u wanna say ju walk wid littl whileamp promis ill bring back ur smile,124
ham,Why nothing. Ok anyway give me treat,36,7,2,noth ok anyway give treat,25
spam,"Win the newest ÛÏHarry Potter and the Order of the Phoenix (Book 5) reply HARRY, answer 5 questions - chance to be the first among readers!",140,26,1,win newest ûïharri potter order phoenix book repli harri answer question chanc first among reader,98
ham,Correct. So how was work today,30,6,2,correct work today,18
ham,"Just sent again. Do you scream and moan in bed, princess?",57,11,2,sent scream moan bed princess,29
ham,"I wake up long ago already... Dunno, what other thing?",54,10,4,wake long ago alreadi dunno thing,33
ham,Oh just getting even with u.... u?,34,7,5,oh get even u u,15
ham,I thk 50 shd be ok he said plus minus 10.. Did Ì_ leave a line in between paragraphs?,85,19,3,thk shd ok said plu minu ì leav line paragraph,46
ham,Can you call me plz. Your number shows out of coveragd area. I have urgnt call in vasai &amp; have to reach before 4'o clock so call me plz,139,29,3,call plz number show coveragd area urgnt call vasai amp reach clock call plz,76
ham,Yeah jay's sort of a fucking retard,35,7,1,yeah jay sort fuck retard,25
ham,"Sorry, was in the bathroom, sup",31,6,1,sorri bathroom sup,18
spam,Ur balance is now å£500. Ur next question is: Who sang 'Uptown Girl' in the 80's ? 2 answer txt ur ANSWER to 83600. Good luck!,126,26,3,ur balanc å£ ur next question sang uptown girl answer txt ur answer good luck,77
ham,My exam is for february 4. Wish you a great day.,48,11,3,exam februari wish great day,28
ham,I dont know what to do to come out of this so only am ask questions like this dont mistake me.,94,21,2,dont know come ask question like dont mistak,44
ham,"Aight no rush, I'll ask jay",27,6,1,aight rush ill ask jay,22
ham,Good Morning plz call me sir,28,6,1,good morn plz call sir,22
ham,It's ok lar. U sleep early too... Nite...,41,8,8,ok lar u sleep earli nite,25
ham,"Oh... Icic... K lor, den meet other day...",42,8,10,oh icic k lor den meet day,26
ham,"Oh ! A half hour is much longer in Syria than Canada, eh ? Wow you must get SO much more work done in a day than us with all that extra time ! *grins*",150,35,1,oh half hour much longer syria canada eh wow must get much work done day us extra time grin,91
ham,"Sometimes we put walls around our hearts,not just to be safe from getting hurt.. But to find out who cares enough to break the walls &amp; get closer.. GOODNOON:)",162,29,5,sometim put wall around heartsnot safe get hurt find care enough break wall amp get closer goodnoon,99
ham,"Sweet, we may or may not go to 4U to meet carlos so gauge patty's interest in that",82,18,1,sweet may may go u meet carlo gaug patti interest,49
ham,Then she buying today? ÌÏ no need to c meh...,45,10,4,buy today ìï need c meh,23
ham,Aight sorry I take ten years to shower. What's the plan?,56,11,2,aight sorri take ten year shower what plan,42
ham,Every monday..nxt week vl be completing..,41,6,5,everi mondaynxt week vl complet,31
ham,Might ax well im there.,23,5,2,might ax well im,16
ham,Just chill for another 6hrs. If you could sleep the pain is not a surgical emergency so see how it unfolds. Okay,112,22,3,chill anoth hr could sleep pain surgic emerg see unfold okay,60
ham,Yeah I'll try to scrounge something up,38,7,1,yeah ill tri scroung someth,27
ham,Crazy ar he's married. ÌÏ like gd looking guys not me. My frens like say he's korean leona's fave but i dun thk he is. Aft some thinking mayb most prob i'll go.,160,33,5,crazi ar he marri ìï like gd look guy fren like say he korean leona fave dun thk aft think mayb prob ill go,107
ham,Were somewhere on Fredericksburg,32,4,1,somewher fredericksburg,23
ham,Que pases un buen tiempo or something like that,47,9,1,que pase un buen tiempo someth like,35
ham,Is it ok if I stay the night here? Xavier has a sleeping bag and I'm getting tired,82,18,1,ok stay night xavier sleep bag im get tire,42
ham,She doesnt need any test.,25,5,2,doesnt need test,16
ham,"Nothing much, chillin at home. Any super bowl plan?",51,9,2,noth much chillin home super bowl plan,38
spam,"FREE2DAY sexy St George's Day pic of Jordan!Txt PIC to 89080 dont miss out, then every wk a saucy celeb!4 more pics c PocketBabe.co.uk 0870241182716 å£3/wk",155,26,3,freeday sexi st georg day pic jordantxt pic dont miss everi wk sauci celeb pic c pocketbabecouk å£wk,100
ham,Bugis oso near wat... ,22,4,4,bugi oso near wat,17
ham,Yo theres no class tmrw right?,30,6,1,yo there class tmrw right,25
ham,Let Ur Heart Be Ur Compass Ur Mind Ur Map Ur Soul Ur Guide And U Will Never loose in world....gnun - Sent via WAY2SMS.COM,121,25,6,let ur heart ur compass ur mind ur map ur soul ur guid u never loos worldgnun sent via waysmscom,96
ham,"Goodnight, sleep well da please take care pa. Please.",53,9,3,goodnight sleep well da pleas take care pa pleas,48
ham,Baaaaabe! I misss youuuuu ! Where are you ? I have to go and teach my class at 5 ...,84,20,4,baaaaab misss youuuuu go teach class,36
ham,U ned to convince him tht its not possible witot hurting his feeling its the main,81,16,1,u ned convinc tht possibl witot hurt feel main,46
ham,"Good afternoon loverboy ! How goes you day ? Any luck come your way? I think of you, sweetie and send my love across the sea to make you smile and happy",152,32,1,good afternoon loverboy goe day luck come way think sweeti send love across sea make smile happi,96
ham,If i start sending blackberry torch to nigeria will you find buyer for me?like 4a month. And tell dad not to buy bb from anyone oh.,131,26,3,start send blackberri torch nigeria find buyer melik month tell dad buy bb anyon oh,83
ham,"&lt;#&gt; %of pple marry with their lovers... becz they hav gud undrstndng dat avoids problems. i sent dis 2 u, u wil get gud news on friday by d person you like. And tomorrow will be the best day of your life. Dont break this chain. If you break you will suffer. send this to  &lt;#&gt;  frnds in &lt;#&gt;  mins whn u read...",327,63,12,ltgt pple marri lover becz hav gud undrstndng dat avoid problem sent di u u wil get gud news friday person like tomorrow best day life dont break chain break suffer send ltgt frnd ltgt min whn u read,199
ham,Yo dude guess who just got arrested the other day,49,10,1,yo dude guess got arrest day,28
ham,Shuhui say change 2 suntec steamboat? U noe where? Where r u now?,65,13,1,shuhui say chang suntec steamboat u noe r u,43
ham,What does the dance river do?,29,6,1,danc river,10
ham,"Yetunde, i'm sorry but moji and i seem too busy to be able to go shopping. Can you just please find some other way to get what you wanted us to get. Please forgive me. You can reply free via yahoo messenger.",207,42,5,yetund im sorri moji seem busi abl go shop pleas find way get want us get pleas forgiv repli free via yahoo messeng,115
ham,Hey i will be really pretty late... You want to go for the lesson first? I will join you. I'm only reaching tp mrt,114,24,5,hey realli pretti late want go lesson first join im reach tp mrt,64
spam,"HOT LIVE FANTASIES call now 08707509020 Just 20p per min NTT Ltd, PO Box 1327 Croydon CR9 5WB 0870..k",101,19,3,hot live fantasi call p per min ntt ltd po box croydon cr wb k,62
ham,Bbq this sat at mine from 6ish. Ur welcome 2 come,49,11,2,bbq sat mine ish ur welcom come,31
ham,"I don't know, same thing that's wrong everyso often, he panicks starts goin on bout not bein good enough Û_",108,20,1,dont know thing that wrong everyso often panick start goin bout bein good enough û,83
ham,Alright. I'm out--have a good night!,36,6,2,alright im outhav good night,28
ham,Did you try making another butt.,32,6,2,tri make anoth butt,19
ham,Hope you are feeling great. Pls fill me in. Abiola,50,10,3,hope feel great pl fill abiola,30
ham,I though we shd go out n have some fun so bar in town or something ÛÒ sound ok?,80,19,1,though shd go n fun bar town someth ûò sound ok,48
ham,"1) Go to write msg 2) Put on Dictionary mode 3)Cover the screen with hand, 4)Press  &lt;#&gt; . 5)Gently remove Ur hand.. Its interesting..:)",141,24,6,go write msg put dictionari mode cover screen hand press ltgt gentli remov ur hand interest,91
spam,"Bears Pic Nick, and Tom, Pete and ... Dick. In fact, all types try gay chat with photo upload call 08718730666 (10p/min). 2 stop texts call 08712460324",151,27,6,bear pic nick tom pete dick fact type tri gay chat photo upload call pmin stop text call,88
spam,"500 New Mobiles from 2004, MUST GO! Txt: NOKIA to No: 89545 & collect yours today!From ONLY å£1 www.4-tc.biz 2optout 087187262701.50gbp/mtmsg18 TXTAUCTION",154,22,4,new mobil must go txt nokia collect todayfrom å£ optout gbpmtmsg txtauction,75
ham,We're finally ready fyi,23,4,1,final readi fyi,15
ham,Auntie huai juan never pick up her phone,40,8,1,aunti huai juan never pick phone,32
spam,Double Mins & Double Txt & 1/2 price Linerental on Latest Orange Bluetooth mobiles. Call MobileUpd8 for the very latest offers. 08000839402 or call2optout/LF56,159,24,3,doubl min doubl txt price linerent latest orang bluetooth mobil call mobileupd latest offer calloptoutlf,104
ham,"Ya tel, wats ur problem..",25,5,3,ya tel wat ur problem,21
ham,i dnt wnt to tlk wid u,22,7,1,dnt wnt tlk wid u,17
ham,"We spend our days waiting for the ideal path to appear in front of us.. But what we forget is.. \paths are made by walking.. not by waiting..\"" Goodnight!""",155,29,9,spend day wait ideal path appear front us forget path made walk wait goodnight,78
ham,Its ok my arm is feeling weak cuz i got a shot so we can go another time,72,18,1,ok arm feel weak cuz got shot go anoth time,43
ham,Please reserve ticket on saturday eve from chennai to thirunelvali and again from tirunelvali to chennai on sunday eve...i already see in net..no ticket available..i want to book ticket through tackle ..,203,32,10,pleas reserv ticket saturday eve chennai thirunelvali tirunelvali chennai sunday evei alreadi see netno ticket availablei want book ticket tackl,144
ham,"Storming msg: Wen u lift d phne, u say \HELLO\"" Do u knw wt is d real meaning of HELLO?? . . . It's d name of a girl..! . . . Yes.. And u knw who is dat girl?? \""Margaret Hello\"" She is d girlfrnd f Grahmbell who invnted telphone... . . . . Moral:One can 4get d name of a person",278,63,18,storm msg wen u lift phne u say hello u knw wt real mean hello name girl ye u knw dat girl margaret hello girlfrnd f grahmbel invnt telphon moralon get name person,163
ham,That's ok. I popped in to ask bout something and she said you'd been in. Are you around tonght wen this girl comes?,115,23,3,that ok pop ask bout someth said youd around tonght wen girl come,65
ham,All e best 4 ur exam later.,27,7,2,e best ur exam later,20
ham,Hope ur head doesn't hurt 2 much ! Am ploughing my way through a pile of ironing ! Staying in with a chinky tonight come round if you like.,139,29,2,hope ur head doesnt hurt much plough way pile iron stay chinki tonight come round like,86
ham,Oh k.i think most of wi and nz players unsold.,46,10,3,oh ki think wi nz player unsold,31
ham,"Haha... Where got so fast lose weight, thk muz go 4 a month den got effect... Gee,later we go aust put bk e weight.",115,24,8,haha got fast lose weight thk muz go month den got effect geelat go aust put bk e weight,88
ham,"I wonder how you got online, my love ? Had you gone to the net cafe ? Did you get your phone recharged ? Were you on a friends net ? I think of you, boytoy",155,36,1,wonder got onlin love gone net cafe get phone recharg friend net think boytoy,77
ham,"Haha just kidding, papa needs drugs",35,6,1,haha kid papa need drug,23
ham,"Thk shld b can... Ya, i wana go 4 lessons... Haha, can go for one whole stretch...",82,17,10,thk shld b ya wana go lesson haha go one whole stretch,54
ham,Oh ok..,7,2,3,oh ok,5
ham,R we still meeting 4 dinner tonight?,36,7,1,r still meet dinner tonight,27
ham,Thats cool! I am a gentleman and will treat you with dignity and respect.,73,14,2,that cool gentleman treat digniti respect,41
ham,Shall i start from hear.,24,5,2,shall start hear,16
ham,Then we wait 4 u lor... No need 2 feel bad lar...,49,12,7,wait u lor need feel bad lar,28
ham,No did you check? I got his detailed message now,48,10,1,check got detail messag,23
ham,You have registered Sinco as Payee. Log in at icicibank.com and enter URN  &lt;#&gt;  to confirm. Beware of frauds. Do NOT share or disclose URN to anyone.,155,27,6,regist sinco paye log icicibankcom enter urn ltgt confirm bewar fraud share disclos urn anyon,93
ham,"No, I decided that only people who care about stuff vote and caring about stuff is for losers",93,18,1,decid peopl care stuff vote care stuff loser,44
ham,Kaiez... Enjoy ur tuition... Gee... Thk e second option sounds beta... I'll go yan jiu den msg u...,99,18,16,kaiez enjoy ur tuition gee thk e second option sound beta ill go yan jiu den msg u,82
ham,cool. We will have fun practicing making babies!,48,8,2,cool fun practic make babi,26
ham,Actually getting ready to leave the house.,42,7,2,actual get readi leav hous,26
ham,K..k..any special today?,24,3,5,kkani special today,19
spam,"URGENT, IMPORTANT INFORMATION FOR O2 USER. TODAY IS YOUR LUCKY DAY! 2 FIND OUT WHY LOG ONTO HTTP://WWW.URAWINNER.COM THERE IS A FANTASTIC SURPRISE AWAITING FOR YOU",163,26,4,urgent import inform user today lucki day find log onto fantast surpris await,77
ham,Then we gotta do it after that,30,7,1,gotta,5
ham,"I've got ten bucks, jay is being noncomittal",44,8,1,ive got ten buck jay noncomitt,30
ham,Where at were hungry too,24,5,1,hungri,6
ham,Pls speak to that customer machan.,34,6,2,pl speak custom machan,22
ham,somewhere out there beneath the pale moon light someone think in of u some where out there where dreams come true... goodnite &amp; sweet dreams,144,25,4,somewher beneath pale moon light someon think u dream come true goodnit amp sweet dream,87
spam,Dear U've been invited to XCHAT. This is our final attempt to contact u! Txt CHAT to 86688 150p/MsgrcvdHG/Suite342/2Lands/Row/W1J6HL LDN 18 yrs,143,22,2,dear uve invit xchat final attempt contact u txt chat pmsgrcvdhgsuitelandsrowwjhl ldn yr,88
ham,So wats ur opinion abt him and how abt is character?,52,11,1,wat ur opinion abt abt charact,30
ham,Jay is snickering and tells me that x is totally fucking up the chords as we speak,82,17,1,jay snicker tell x total fuck chord speak,41
ham,No..few hours before.went to hair cut .,39,7,5,nofew hour beforew hair cut,27
ham,No wonder... Cos i dun rem seeing a silver car... But i thk i saw a black one...,80,18,10,wonder co dun rem see silver car thk saw black one,50
ham,Lmao. Take a pic and send it to me.,35,9,3,lmao take pic send,18
ham,"\Speak only when you feel your words are better than the silence...\"" Gud mrng:-)""",82,14,4,speak feel word better silenc gud mrng,38
ham,No. She's currently in scotland for that.,41,7,3,she current scotland,20
ham,Do you work all this week ?,27,7,1,work week,9
spam,Congratulations ur awarded either å£500 of CD gift vouchers & Free entry 2 our å£100 weekly draw txt MUSIC to 87066 TnCs www.Ldew.com 1 win150ppmx3age16,152,25,3,congratul ur award either å£ cd gift voucher free entri å£ weekli draw txt music tnc winppmxag,94
ham,Lol great now im getting hungry.,32,6,2,lol great im get hungri,23
ham,Yes.. now only saw your message..,33,6,5,ye saw messag,13
ham,I'll be at mu in like  &lt;#&gt;  seconds,41,8,1,ill mu like ltgt second,23
ham,THING R GOOD THANX GOT EXAMS IN MARCH IVE DONE NO REVISION? IS FRAN STILL WITH BOYF? IVE GOTTA INTERVIW 4 EXETER BIT WORRIED!x,126,24,1,thing r good thanx got exam march ive done revis fran still boyf ive gotta interviw exet bit worriedx,101
ham,"Tell you what, if you make a little spreadsheet and track whose idea it was to smoke to determine who \smokes too much\"" for the entire month of february",153,29,1,tell make littl spreadsheet track whose idea smoke determin smoke much entir month februari,91
spam,For sale - arsenal dartboard. Good condition but no doubles or trebles!,71,12,2,sale arsen dartboard good condit doubl trebl,44
ham,Don't look back at the building because you have no coat and i don't want you to get more sick. Just hurry home and wear a coat to the gym!!!,141,30,2,dont look back build coat dont want get sick hurri home wear coat gym,69
ham,"My painful personal thought- \I always try to keep everybody happy all the time. But nobody recognises me when i am alone\""""",124,22,2,pain person thought alway tri keep everybodi happi time nobodi recognis alon,76
ham,Thanks for ve lovely wisheds. You rock,38,7,2,thank love wish rock,20
