Label,Message,Message_Length,Word_Count,Sentence_Count,Transformed_Message,Clean_Length
ham,"She is our sister.. She belongs 2 our family.. She is d hope of tomorrow.. Pray 4 her,who was fated 4 d Shoranur train incident. Lets hold our hands together &amp; fuelled by love &amp; concern prior 2 her grief &amp; pain. Pls join in dis chain &amp; pass it. STOP VIOLENCE AGAINST WOMEN.",289,54,11,sister belong famili hope tomorrow pray herwho fate shoranur train incid let hold hand togeth amp fuell love amp concern prior grief amp pain pl join di chain amp pass stop violenc women,186
ham,So are you guys asking that i get that slippers again or its gone with last year,80,17,1,guy ask get slipper gone last year,34
ham,Company is very good.environment is terrific and food is really nice:),70,11,2,compani goodenviron terrif food realli nice,43
spam,"Text82228>> Get more ringtones, logos and games from www.txt82228.com. Questions: info@txt82228.co.uk",101,11,6,text get rington logo game question infotxtcouk,47
ham,Honestly i've just made a lovely cup of tea and promptly dropped my keys in it and then burnt my fingers getting them out!,122,24,1,honestli ive made love cup tea promptli drop key burnt finger get,65
ham,Yup but not studying surfing lor. I'm in e lazy mode today.,59,12,3,yup studi surf lor im e lazi mode today,39
ham,Please sen :)my kind advice :-)please come here and try:-),58,10,1,pleas sen kind advic pleas come tri,35
ham,I'm done. C Ì_ there.,21,5,3,im done c ì,11
ham,"Oh fine, I'll be by tonight",27,6,1,oh fine ill tonight,19
ham,ÌÏ give me some time to walk there.,35,8,2,ìï give time walk,17
ham,I'll reach in ard 20 mins ok...,31,7,4,ill reach ard min ok,20
spam,"FreeMSG You have been awarded a FREE mini DIGITAL CAMERA, just reply SNAP to collect your prize! (quizclub Opt out? Stop 80122300p/wk SP:RWM Ph:08704050406)",156,24,1,freemsg award free mini digit camera repli snap collect prize quizclub opt stop pwk sprwm ph,92
ham,Fuck babe ... What happened to you ? How come you never came back?,66,14,4,fuck babe happen come never came back,37
spam,This message is brought to you by GMW Ltd. and is not connected to the,70,15,2,messag brought gmw ltd connect,30
ham,"Some friends want me to drive em someplace, probably take a while",65,12,1,friend want drive em someplac probabl take,42
ham,I also thk too fast... Xy suggest one not me. U dun wan it's ok. Going 2 rain leh where got gd.,95,22,7,also thk fast xy suggest one u dun wan ok go rain leh got gd,60
ham,Are you still getting the goods.,32,6,2,still get good,14
ham,And maybe some pressies,23,4,1,mayb pressi,11
ham,"Yeah I am, so I'll leave maybe 7ish?",36,8,1,yeah ill leav mayb ish,22
ham,I told her I had a Dr appt next week. She thinks I'm gonna die. I told her its just a check. Nothing to be worried about. But she didn't listen.,144,31,6,told dr appt next week think im gonna die told check noth worri didnt listen,76
ham,You in your room? I need a few,30,8,1,room need,9
ham,I dont want to hear anything,28,6,1,dont want hear anyth,20
ham,Hey. For me there is no leave on friday. Wait i will ask my superior and tell you..,83,18,5,hey leav friday wait ask superior tell,38
ham,Ultimately tor motive tui achieve korli.,40,6,2,ultim tor motiv tui achiev korli,32
ham,From 5 to 2 only my work timing.,32,8,2,work time,9
ham,Û_ and donÛ÷t worry weÛ÷ll have finished by march Û_ ish!,61,11,1,û donû÷t worri weû÷ll finish march û ish,44
ham,"The house is on the water with a dock, a boat rolled up with a newscaster who dabbles in jazz flute behind the wheel",116,24,1,hous water dock boat roll newscast dabbl jazz flute behind wheel,64
spam,"Congrats 2 mobile 3G Videophones R yours. call 09063458130 now! videochat wid ur mates, play java games, Dload polypH music, noline rentl. bx420. ip4. 5we. 150p",160,26,6,congrat mobil g videophon r call videochat wid ur mate play java game dload polyph music nolin rentl bx ip p,108
spam,Your next amazing xxx PICSFREE1 video will be sent to you enjoy! If one vid is not enough for 2day text back the keyword PICSFREE1 to get the next video.,153,30,2,next amaz xxx picsfre video sent enjoy one vid enough day text back keyword picsfre get next video,98
ham,Now thats going to ruin your thesis!,36,7,1,that go ruin thesi,18
ham,In sch but neva mind u eat 1st lor..,36,9,3,sch neva mind u eat st lor,26
ham,Hey whats up? U sleeping all morning?,37,7,1,hey what u sleep morn,21
ham,Erm. I thought the contract ran out the4th of october.,54,10,3,erm thought contract ran theth octob,36
ham,I dunno until when... Lets go learn pilates...,46,8,7,dunno let go learn pilat,24
spam,U are subscribed to the best Mobile Content Service in the UK for å£3 per ten days until you send STOP to 83435. Helpline 08706091795.,134,25,3,u subscrib best mobil content servic uk å£ per ten day send stop helplin,72
ham,Yup i'm elaborating on the safety aspects and some other issues..,65,11,3,yup im elabor safeti aspect issu,32
spam,"3 FREE TAROT TEXTS! Find out about your love life now! TRY 3 FOR FREE! Text CHANCE to 85555 16 only! After 3 Free, Msgs å£1.50 each",131,27,2,free tarot text find love life tri free text chanc free msg å£,62
ham,"Goodmorning, today i am late for 1hr.",37,7,2,goodmorn today late hr,22
ham,Hi happy birthday. Hi hi hi hi hi hi hi,39,10,2,hi happi birthday hi hi hi hi hi hi hi,38
ham,I will be outside office take all from there,44,9,1,outsid offic take,17
ham,If you don't respond imma assume you're still asleep and imma start calling n shit,82,15,1,dont respond imma assum your still asleep imma start call n shit,64
ham,"Aight, see you in a bit",23,6,1,aight see bit,13
ham,My superior telling that friday is leave for all other department except ours:)so it will be leave for you:)any way call waheed fathima hr and conform it:),155,27,1,superior tell friday leav depart except oursso leav youani way call wahe fathima hr conform,91
spam,Join the UK's horniest Dogging service and u can have sex 2nite!. Just sign up and follow the instructions. Txt ENTRY to 69888 now! Nyt.EC2A.3LP.msg@150p,153,25,6,join uk horniest dog servic u sex nite sign follow instruct txt entri nytecalpmsgp,82
ham,Lol I have to take it. member how I said my aunt flow didn't visit for 6 months? It's cause I developed ovarian cysts. Bc is the only way to shrink them.,153,32,4,lol take member said aunt flow didnt visit month caus develop ovarian cyst bc way shrink,88
ham,Still work going on:)it is very small house.,44,8,2,still work go onit small hous,29
ham,"My friend just got here and says he's upping his order by a few grams (he's got $ &lt;#&gt; ), when can you get here?",117,25,1,friend got say he up order gram he got ltgt get,47
ham,Tmr timin still da same wat cos i got lesson until 6...,55,12,4,tmr timin still da wat co got lesson,36
ham,"ThatÛ÷s the thing with apes, u can fight to the death to keep something, but the minute they have it when u let go, thats it!",126,26,1,thatû÷ thing ape u fight death keep someth minut u let go that,63
ham,No i'm not gonna be able to. || too late notice. || i'll be home in a few weeks anyway. || what are the plans,109,25,4,im gonna abl late notic ill home week anyway plan,49
ham,"Got fujitsu, ibm, hp, toshiba... Got a lot of model how to say...",65,13,7,got fujitsu ibm hp toshiba got lot model say,44
ham,Okie... Thanx...,16,2,7,oki thanx,9
ham,"Gosh that , what a pain. Spose I better come then.",50,11,3,gosh pain spose better come,27
ham,"As usual..iam fine, happy &amp; doing well..:)",46,7,5,usualiam fine happi amp well,28
ham,Okie,4,1,1,oki,3
ham,So when you gonna get rimac access ,35,7,1,gonna get rimac access,22
ham,"\Im at arestaurant eating squid! i will be out about 10:30 wanna dosomething or is that to late?\""""",99,18,1,im arestaur eat squid wanna dosometh late,41
ham,You call times job today ok umma and ask them to speed up,57,13,1,call time job today ok umma ask speed,37
ham,"\HELLO U.CALL WEN U FINISH WRK.I FANCY MEETIN UP WIV U ALL TONITE AS I NEED A BREAK FROM DABOOKS. DID 4 HRS LAST NITE+2 TODAY OF WRK!\""""",136,28,4,hello ucal wen u finish wrki fanci meetin wiv u tonit need break dabook hr last nite today wrk,94
ham,R U &SAM P IN EACHOTHER. IF WE MEET WE CAN GO 2 MY HOUSE,56,15,2,r u sam p eachoth meet go hous,30
ham,:-) yeah! Lol. Luckily i didn't have a starring role like you!,62,12,2,yeah lol luckili didnt star role like,37
ham,Hello madam how are you ?,25,6,1,hello madam,11
ham,"Awesome, text me when you're restocked",38,6,1,awesom text your restock,24
spam,Knock Knock Txt whose there to 80082 to enter r weekly draw 4 a å£250 gift voucher 4 a store of yr choice. T&Cs www.tkls.com age16 to stoptxtstopå£1.50/week,156,28,5,knock knock txt whose enter r weekli draw å£ gift voucher store yr choic tc age stoptxtstopå£week,97
ham,Yes. It's all innocent fun. O:-),32,6,3,ye innoc fun,12
ham,Thanks for sending this mental ability question..,49,7,3,thank send mental abil question,31
ham,"Sir, hope your day is going smoothly. i really hoped i wont have to bother you about this. I have some bills that i can't settle this month. I am out of all extra cash. I know this is a challenging time for you also but i have to let you know.",243,52,6,sir hope day go smoothli realli hope wont bother bill cant settl month extra cash know challeng time also let know,114
ham,2marrow only. Wed at  &lt;#&gt;  to 2 aha.,42,8,3,marrow wed ltgt aha,19
ham,I went to ur hon lab but no one is there.,41,11,2,went ur hon lab one,19
ham,Hey pple...$700 or $900 for 5 nights...Excellent location wif breakfast hamper!!!,81,11,7,hey pple nightsexcel locat wif breakfast hamper,47
spam,<Forwarded from 21870000>Hi - this is your Mailbox Messaging SMS alert. You have 40 matches. Please call back on 09056242159 to retrieve your messages and matches cc100p/min,173,27,3,hi mailbox messag sm alert match pleas call back retriev messag match ccpmin,76
ham,How come?,9,2,1,come,4
ham,Lol! Nah wasn't too bad thanks. Its good to b home but its been quite a reality check. Hows ur day been? Did u do anything with website?,136,28,3,lol nah wasnt bad thank good b home quit realiti check how ur day u anyth websit,80
ham,Ok lor...,9,2,4,ok lor,6
ham,I'm coming home 4 dinner.,25,5,2,im come home dinner,19
ham,S da..al r above  &lt;#&gt;,27,5,3,daal r ltgt,11
spam,"FREE RING TONE just text \POLYS\"" to 87131. Then every week get a new tone. 0870737910216yrs only å£1.50/wk.""",109,18,5,free ring tone text poli everi week get new tone yr å£wk,56
ham,Unni thank you dear for the recharge..Rakhesh,45,7,3,unni thank dear rechargerakhesh,31
ham,I know I'm lacking on most of this particular dramastorm's details but for the most part I'm not worried about that,115,21,1,know im lack particular dramastorm detail part im worri,55
ham,Haha... They cant what... At the most tmr forfeit... haha so how?,65,12,10,haha cant tmr forfeit haha,26
ham,"Hey there! Glad u r better now. I hear u treated urself to a digi cam, is it good? We r off at 9pm. Have a fab new year, c u in coupla wks!",139,34,3,hey glad u r better hear u treat urself digi cam good r pm fab new year c u coupla wk,85
ham,No way I'm going back there!,28,6,1,way im go back,14
spam,"URGENT! Your mobile No 077xxx WON a å£2,000 Bonus Caller Prize on 02/06/03! This is the 2nd attempt to reach YOU! Call 09066362206 ASAP! BOX97N7QP, 150ppm",154,26,1,urgent mobil xxx å£ bonu caller prize nd attempt reach call asap boxnqp ppm,75
ham,I WILL CAL YOU SIR. In meeting,30,7,2,cal sir meet,12
ham,"That's what I love to hear :V see you sundayish, then",53,11,1,that love hear v see sundayish,30
ham,"Sorry da thangam, very very sorry i am held up with prasad.",59,12,2,sorri da thangam sorri held prasad,34
ham,Tiwary to rcb.battle between bang and kochi.,44,7,3,tiwari rcbbattl bang kochi,26
ham,Thank god they are in bed!,26,6,1,thank god bed,13
ham,No I don't have cancer. Moms making a big deal out of a regular checkup aka pap smear,85,18,2,dont cancer mom make big deal regular checkup aka pap smear,59
ham,Am in gobi arts college,23,5,1,gobi art colleg,15
ham,Why she wants to talk to me,27,7,1,want talk,9
ham,Pandy joined 4w technologies today.he got job..,47,7,4,pandi join w technolog todayh got job,37
spam,"You are guaranteed the latest Nokia Phone, a 40GB iPod MP3 player or a å£500 prize! Txt word: COLLECT to No: 83355! IBHltd LdnW15H 150p/Mtmsgrcvd18",147,25,1,guarante latest nokia phone gb ipod mp player å£ prize txt word collect ibhltd ldnwh pmtmsgrcvd,95
ham,"They can try! They can get lost, in fact. Tee hee",49,11,2,tri get lost fact tee hee,25
ham,My friends use to call the same.,32,7,2,friend use call,15
ham,"Em, its olowoyey@ usc.edu have a great time in argentina. Not sad about secretary, everything is a blessing",107,18,3,em olowoyey uscedu great time argentina sad secretari everyth bless,67
ham,"It,,s a taxt massage....tie-pos argh ok! Lool!",46,7,5,taxt massagetiepo argh ok lool,30
ham,"Hi, can i please get a  &lt;#&gt;  dollar loan from you. I.ll pay you back by mid february. Pls.",96,19,5,hi pleas get ltgt dollar loan ill pay back mid februari pl,58
ham,"You might want to pull out more just in case and just plan on not spending it if you can, I don't have much confidence in derek and taylor's money management",157,31,1,might want pull case plan spend dont much confid derek taylor money manag,73
ham,Do you like shaking your booty on the dance floor?,50,10,1,like shake booti danc floor,27
ham,"Text me when you get off, don't call, my phones having problems",63,12,1,text get dont call phone problem,32
ham,No need for the drug anymore.,29,6,2,need drug anymor,16
ham,Sorry da:)i was thought of calling you lot of times:)lil busy.i will call you at noon..,87,16,4,sorri dai thought call lot timeslil busyi call noon,51
ham,Its sarcasm.. .nt scarcasim,27,4,4,sarcasm nt scarcasim,20
ham,Great! I have to run now so ttyl!,33,8,1,great run ttyl,14
ham,Feel like trying kadeem again? :V,33,6,1,feel like tri kadeem v,22
ham,Dai  &lt;#&gt;  naal eruku.,27,4,2,dai ltgt naal eruku,19
ham,Not yet chikku..wat abt u?,26,5,3,yet chikkuwat abt u,19
ham,Want to finally have lunch today?,33,6,1,want final lunch today,22
ham,Do you know when dad will be back?,34,8,1,know dad back,13
spam,"Hello darling how are you today? I would love to have a chat, why dont you tell me what you look like and what you are in to sexy?",130,29,1,hello darl today would love chat dont tell look like sexi,57
spam,8007 FREE for 1st week! No1 Nokia tone 4 ur mob every week just txt NOKIA to 8007 Get txting and tell ur mates www.getzed.co.uk POBox 36504 W4 5WQ norm 150p/tone 16+,165,32,4,free st week nokia tone ur mob everi week txt nokia get txting tell ur mate pobox w wq norm ptone,97
ham,He remains a bro amongst bros,29,6,1,remain bro amongst bro,22
ham,R u meeting da ge at nite tmr?,30,8,1,r u meet da ge nite tmr,23
ham,"* Was a nice day and, impressively, i was sensible, went home early and now feel fine. Or am i just boring?! When's yours, i can't remember.",140,27,3,nice day impress sensibl went home earli feel fine bore when cant rememb,72
ham,Why de. You looking good only:-)..,34,6,4,de look good,12
spam,Wanna get laid 2nite? Want real Dogging locations sent direct to ur mobile? Join the UK's largest Dogging Network. Txt PARK to 69696 now! Nyt. ec2a. 3lp å£1.50/msg,163,28,5,wanna get laid nite want real dog locat sent direct ur mobil join uk largest dog network txt park nyt eca lp å£msg,114
spam,we tried to contact you re your response to our offer of a new nokia fone and camcorder hit reply or call 08000930705 for delivery,130,25,1,tri contact respons offer new nokia fone camcord hit repli call deliveri,72
ham,Yes. They replied my mail. I'm going to the management office later. Plus will in to bank later also.or on wednesday.,117,21,6,ye repli mail im go manag offic later plu bank later alsoor wednesday,69
ham,"That's cool, I'll come by like  &lt;#&gt; ish",45,8,1,that cool ill come like ltgt ish,32
ham,Super msg da:)nalla timing.,27,4,2,super msg danalla time,22
ham,"Good afternoon, my boytoy ... How are you feeling today ? Better I hope? Are you being my good boy? Are you my obedient, slave? Do you please your Queen?",153,30,4,good afternoon boytoy feel today better hope good boy obedi slave pleas queen,77
ham,I am 6 ft. We will be a good combination!,41,10,2,ft good combin,14
ham,I'm sick !! I'm needy !! I want you !! *pouts* *stomps feet* Where are you ?! *pouts* *stomps feet* I want my slave !! I want him now !!,136,30,1,im sick im needi want pout stomp feet pout stomp feet want slave want,69
ham,* Am on a train back from northampton so i'm afraid not!,56,12,1,train back northampton im afraid,32
ham,Where in abj are you serving. Are you staying with dad or alone.,64,13,3,abj serv stay dad alon,22
ham,Was playng 9 doors game and gt racing on phone lol,50,11,1,playng door game gt race phone lol,34
spam,"New Tones This week include: 1)McFly-All Ab.., 2) Sara Jorge-Shock.. 3) Will Smith-Switch.. To order follow instructions on next message",136,20,7,new tone week includ mcflyall ab sara jorgeshock smithswitch order follow instruct next messag,94
ham,I'm on da bus going home...,27,6,4,im da bu go home,16
ham,I got a call from a landline number. . . I am asked to come to anna nagar . . . I will go in the afternoon,106,27,7,got call landlin number ask come anna nagar go afternoon,56
ham,I'm okay. Chasing the dream. What's good. What are you doing next.,66,12,5,im okay chase dream what good next,34
ham,Yupz... I've oredi booked slots 4 my weekends liao... ,54,9,7,yupz ive oredi book slot weekend liao,37
spam,URGENT! We are trying to contact U. Todays draw shows that you have won a å£800 prize GUARANTEED. Call 09050003091 from land line. Claim C52. Valid 12hrs only,158,28,5,urgent tri contact u today draw show å£ prize guarante call land line claim c valid hr,86
ham,There r many model..sony ericson also der.. &lt;#&gt; ..it luks good bt i forgot modl no,88,16,7,r mani modelsoni ericson also der ltgt luk good bt forgot modl,62
ham,Yes I know the cheesy songs from frosty the snowman :),54,11,1,ye know cheesi song frosti snowman,34
ham,"Ya ok, vikky vl c witin  &lt;#&gt; mins and il reply u..",56,12,3,ya ok vikki vl c witin ltgt min il repli u,42
spam,sports fans - get the latest sports news str* 2 ur mobile 1 wk FREE PLUS a FREE TONE Txt SPORT ON to 8007 www.getzed.co.uk 0870141701216+ norm 4txt/120p ,153,28,4,sport fan get latest sport news str ur mobil wk free plu free tone txt sport norm txtp,86
ham,Hey tmr meet at bugis 930 ?,27,7,1,hey tmr meet bugi,17
spam,"Urgent Urgent! We have 800 FREE flights to Europe to give away, call B4 10th Sept & take a friend 4 FREE. Call now to claim on 09050000555. BA128NNFWFLY150ppm",158,29,3,urgent urgent free flight europ give away call b th sept take friend free call claim bannfwflyppm,97
ham,All these nice new shirts and the only thing I can wear them to is nudist themed ;_; you in mu?,95,21,1,nice new shirt thing wear nudist theme mu,41
ham,Hey sexy buns! What of that day? No word from you this morning on YM ... :-( ... I think of you,95,22,7,hey sexi bun day word morn ym think,35
ham,And whenever you and i see we can still hook up too.,52,12,2,whenev see still hook,21
ham,Nope but i'm going home now then go pump petrol lor... Like going 2 rain soon...,80,16,7,nope im go home go pump petrol lor like go rain soon,52
ham,Can you use foreign stamps for whatever you send them off for? ,63,12,1,use foreign stamp whatev send,29
spam,FROM 88066 LOST å£12 HELP,25,5,1,lost å£ help,12
ham,Oh baby of the house. How come you dont have any new pictures on facebook,73,15,2,oh babi hous come dont new pictur facebook,42
ham,"Feb  &lt;#&gt;  is \I LOVE U\"" day. Send dis to all ur \""VALUED FRNDS\"" evn me. If 3 comes back u'll gt married d person u luv! If u ignore dis u will lose ur luv 4 Evr""",169,38,3,feb ltgt love u day send di ur valu frnd evn come back ull gt marri person u luv u ignor di u lose ur luv evr,109
ham,"Hiya, sorry didn't hav signal. I haven't seen or heard from and neither has, which is unusual in itself! I'll put on the case and get him to sort it out! Hugs and snogs.",169,34,3,hiya sorri didnt hav signal havent seen heard neither unusu ill put case get sort hug snog,90
ham,"Omw back to tampa from west palm, you hear what happened?",57,11,1,omw back tampa west palm hear happen,36
ham,Yup no more already... Thanx 4 printing n handing it up.,56,11,5,yup alreadi thanx print n hand,30
spam,FreeMsg: Fancy a flirt? Reply DATE now & join the UKs fastest growing mobile dating service. Msgs rcvd just 25p to optout txt stop to 83021. Reply DATE now!,156,29,3,freemsg fanci flirt repli date join uk fastest grow mobil date servic msg rcvd p optout txt stop repli date,107
ham,What i mean is do they come chase you out when its over or is it stated you can watch as many movies as you want.,113,26,2,mean come chase state watch mani movi want,42
ham,S now only i took tablets . Reaction morning only.,50,10,3,took tablet reaction morn,25
spam,Great NEW Offer - DOUBLE Mins & DOUBLE Txt on best Orange tariffs AND get latest camera phones 4 FREE! Call MobileUpd8 free on 08000839402 NOW! or 2stoptxt T&Cs,160,29,1,great new offer doubl min doubl txt best orang tariff get latest camera phone free call mobileupd free stoptxt tc,113
ham,"Nah, I'm a perpetual DD",23,5,1,nah im perpetu dd,17
ham,Sorry de i went to shop.,24,6,2,sorri de went shop,18
spam,Hope you enjoyed your new content. text stop to 61610 to unsubscribe. help:08712400602450p Provided by tones2you.co.uk,118,16,5,hope enjoy new content text stop unsubscrib helpp provid tonesyoucouk,69
ham,Hey you still want to go for yogasana? Coz if we end at cine then can go bathe and hav the steam bath,101,23,1,hey still want go yogasana coz end cine go bath hav steam bath,62
ham,Nope i'm not drivin... I neva develop da photos lei...,54,10,7,nope im drivin neva develop da photo lei,40
ham,I am thinking of going down to reg for pract lessons.. Flung my advance.. Haha wat time u going?,96,19,5,think go reg pract lesson flung advanc haha wat time u go,57
ham,Cool. I am  &lt;#&gt;  inches long. hope you like them big!,59,11,3,cool ltgt inch long hope like big,33
ham,"House-Maid is the murderer, coz the man was murdered on  &lt;#&gt; th January.. As public holiday all govt.instituitions are closed,including post office..understand?",166,22,6,housemaid murder coz man murder ltgt th januari public holiday govtinstituit closedinclud post officeunderstand,111
ham,Okie.. Thanx..,14,2,5,oki thanx,9
ham,Go where n buy? Juz buy when we get there lar.,46,11,2,go n buy juz buy get lar,24
ham,I'm working technical support :)voice process.,46,6,2,im work technic support voic process,36
ham,It's justbeen overa week since we broke up and already our brains are going to mush!,84,16,1,justbeen overa week sinc broke alreadi brain go mush,52
ham,"Tunde, how are you doing. This is just wishing you a great day. Abiola.",71,14,4,tund wish great day abiola,26
ham,Nope... C Ì_ then...,20,4,7,nope c ì,8
ham,No. But we'll do medical missions to nigeria,44,8,2,well medic mission nigeria,26
ham,No i am not having not any movies in my laptop,46,11,1,movi laptop,11
spam,Urgent Please call 09066612661 from landline. å£5000 cash or a luxury 4* Canary Islands Holiday await collection. T&Cs SAE award. 20M12AQ. 150ppm. 16+ ÛÏ,154,24,6,urgent pleas call landlin å£ cash luxuri canari island holiday await collect tc sae award maq ppm ûï,101
spam,"Urgent! Please call 09066612661 from your landline, your complimentary 4* Lux Costa Del Sol holiday or å£1000 CASH await collection. ppm 150 SAE T&Cs James 28, EH74RR",166,27,2,urgent pleas call landlin complimentari lux costa del sol holiday å£ cash await collect ppm sae tc jame ehrr,108
ham,I havent lei.. Next mon can?,28,6,3,havent lei next mon,19
ham,Mm feeling sleepy. today itself i shall get that dear,53,10,2,mm feel sleepi today shall get dear,35
ham,How dare you stupid. I wont tell anything to you. Hear after i wont talk to you:-.,82,17,4,dare stupid wont tell anyth hear wont talk,42
ham,Do Ì_ noe if ben is going?,26,7,1,ì noe ben go,12
ham,Can you do a mag meeting this avo at some point?,48,11,1,mag meet avo point,18
ham,I meant middle left or right?,29,6,1,meant middl left right,22
ham,Really? I crashed out cuddled on my sofa.,41,8,2,realli crash cuddl sofa,23
ham,Hi Chachi tried calling u now unable to reach u .. Pl give me a missed cal once u c tiz msg  Kanagu,99,23,3,hi chachi tri call u unabl reach u pl give miss cal u c tiz msg kanagu,70
ham,"I sent you the prices and do you mean the  &lt;#&gt; g,",55,12,1,sent price mean ltgt g,22
ham,Nothing. Can...,15,2,5,noth,4
ham,No * am working on the ringing u thing but have whole houseful of screaming brats so * am pulling my hair out! Loving u,119,25,1,work ring u thing whole hous scream brat pull hair love u,57
ham,But my family not responding for anything. Now am in room not went to home for diwali but no one called me and why not coming. It makes me feel like died.,154,32,4,famili respond anyth room went home diwali one call come make feel like die,75
ham,"Tick, tick, tick ... Babe",25,5,4,tick tick tick babe,19
ham,R Ì_ going 4 today's meeting?,29,6,1,r ì go today meet,17
ham,K da:)how many page you want?,29,6,1,k dahow mani page want,22
ham,Ya had just now.onion roast.,28,5,3,ya nowonion roast,17
ham,Send his number and give reply tomorrow morning for why you said that to him like that ok,89,18,1,send number give repli tomorrow morn said like ok,49
ham,You said not now. No problem. When you can. Let me know.,56,12,5,said problem let know,21
ham,Ok but tell me half an hr b4 u come i need 2 prepare.,53,14,2,ok tell half hr b u come need prepar,36
