Label,Message,Message_Length,Word_Count,Sentence_Count,Transformed_Message,Clean_Length
ham,"Go until jurong point, crazy.. Available only in bugis n great world la e buffet... Cine there got amore wat...",111,20,9,go jurong point crazi avail bugi n great world la e buffet cine got amor wat,76
ham,Ok lar... Joking wif u oni...,29,6,7,ok lar joke wif u oni,21
spam,Free entry in 2 a wkly comp to win FA Cup final tkts 21st May 2005. Text FA to 87121 to receive entry question(std txt rate)T&C's apply 08452810075over18's,155,28,2,free entri wkli comp win fa cup final tkt st may text fa receiv entri questionstd txt ratetc appli over,103
ham,U dun say so early hor... U c already then say...,49,11,7,u dun say earli hor u c alreadi say,35
ham,"Nah I don't think he goes to usf, he lives around here though",61,13,1,nah dont think goe usf live around though,41
spam,"FreeMsg Hey there darling it's been 3 week's now and no word back! I'd like some fun you up for it still? Tb ok! XxX std chgs to send, å£1.50 to rcv",148,32,2,freemsg hey darl week word back id like fun still tb ok xxx std chg send å£ rcv,79
ham,Even my brother is not like to speak with me. They treat me like aids patent.,77,16,3,even brother like speak treat like aid patent,45
ham,As per your request 'Melle Melle (Oru Minnaminunginte Nurungu Vettam)' has been set as your callertune for all Callers. Press *9 to copy your friends Callertune,160,26,2,per request mell mell oru minnaminungint nurungu vettam set callertun caller press copi friend callertun,104
spam,WINNER!! As a valued network customer you have been selected to receivea å£900 prize reward! To claim call 09061701461. Claim code KL341. Valid 12 hours only.,158,26,4,winner valu network custom select receivea å£ prize reward claim call claim code kl valid hour,94
spam,Had your mobile 11 months or more? U R entitled to Update to the latest colour mobiles with camera for Free! Call The Mobile Update Co FREE on 08002986030,154,29,1,mobil month u r entitl updat latest colour mobil camera free call mobil updat co free,85
ham,"I'm gonna be home soon and i don't want to talk about this stuff anymore tonight, k? I've cried enough today.",109,21,2,im gonna home soon dont want talk stuff anymor tonight k ive cri enough today,77
spam,"SIX chances to win CASH! From 100 to 20,000 pounds txt> CSH11 and send to 87575. Cost 150p/day, 6days, 16+ TsandCs apply Reply HL 4 info",136,26,2,six chanc win cash pound txt csh send cost pday day tsandc appli repli hl info,78
spam,"URGENT! You have won a 1 week FREE membership in our å£100,000 Prize Jackpot! Txt the word: CLAIM to No: 81010 T&C www.dbuk.net LCCLTD POBOX 4403LDNW1A7RW18",156,26,3,urgent week free membership å£ prize jackpot txt word claim tc lccltd pobox ldnwarw,83
ham,I've been searching for the right words to thank you for this breather. I promise i wont take your help for granted and will fulfil my promise. You have been wonderful and a blessing at all times.,196,37,4,ive search right word thank breather promis wont take help grant fulfil promis wonder bless time,96
ham,I HAVE A DATE ON SUNDAY WITH WILL!!,35,8,1,date sunday,11
spam,"XXXMobileMovieClub: To use your credit, click the WAP link in the next txt message or click here>> http://wap. xxxmobilemovieclub.com?n=QJKGIGHJJGCBL",149,19,3,xxxmobilemovieclub use credit click wap link next txt messag click xxxmobilemovieclubcomnqjkgighjjgcbl,102
ham,Oh k...i'm watching here:),26,4,4,oh kim watch,12
ham,Eh u remember how 2 spell his name... Yes i did. He v naughty make until i v wet.,81,19,6,eh u rememb spell name ye v naughti make v wet,46
ham,Fine if thatåÕs the way u feel. ThatåÕs the way its gota b,58,13,2,fine thatåõ way u feel thatåõ way gota b,40
spam,"England v Macedonia - dont miss the goals/team news. Txt ur national team to 87077 eg ENGLAND to 87077 Try:WALES, SCOTLAND 4txt/Ì¼1.20 POBOXox36504W45WQ 16+",156,24,3,england v macedonia dont miss goalsteam news txt ur nation team eg england trywal scotland txtì¼ poboxoxwwq,107
ham,Is that seriously how you spell his name?,41,8,1,serious spell name,18
ham,IÛ÷m going to try for 2 months ha ha only joking,49,11,1,iû÷m go tri month ha ha joke,29
ham,So Ì_ pay first lar... Then when is da stock comin...,53,11,7,ì pay first lar da stock comin,30
ham,Aft i finish my lunch then i go str down lor. Ard 3 smth lor. U finish ur lunch already?,88,20,3,aft finish lunch go str lor ard smth lor u finish ur lunch alreadi,66
ham,Ffffffffff. Alright no way I can meet up with you sooner?,57,11,2,ffffffffff alright way meet sooner,34
ham,Just forced myself to eat a slice. I'm really not hungry tho. This sucks. Mark is getting worried. He knows I'm sick when I turn down pizza. Lol,144,28,6,forc eat slice im realli hungri tho suck mark get worri know im sick turn pizza lol,83
ham,Lol your always so convincing.,30,5,2,lol alway convinc,17
ham,Did you catch the bus ? Are you frying an egg ? Did you make a tea? Are you eating your mom's left over dinner ? Do you feel my Love ?,134,32,1,catch bu fri egg make tea eat mom left dinner feel love,55
ham,"I'm back &amp; we're packing the car now, I'll let you know if there's room",75,15,1,im back amp pack car ill let know there room,44
ham,Ahhh. Work. I vaguely remember that! What does it feel like? Lol,64,12,3,ahhh work vagu rememb feel like lol,35
ham,"Wait that's still not all that clear, were you not sure about me being sarcastic or that that's why x doesn't want to live with us",130,26,1,wait that still clear sure sarcast that x doesnt want live us,61
ham,Yeah he got in at 2 and was v apologetic. n had fallen out and she was actin like spoilt child and he got caught up in that. Till 2! But we won't go there! Not doing too badly cheers. You? ,189,41,4,yeah got v apologet n fallen actin like spoilt child got caught till wont go badli cheer,88
ham,K tell me anything about you.,29,6,2,k tell anyth,12
ham,For fear of fainting with the of all that housework you just did? Quick have a cuppa,84,17,1,fear faint housework quick cuppa,32
spam,Thanks for your subscription to Ringtone UK your mobile will be charged å£5/month Please confirm by replying YES or NO. If you reply NO you will not be charged,159,29,2,thank subscript rington uk mobil charg å£month pleas confirm repli ye repli charg,81
ham,Yup... Ok i go home look at the timings then i msg Ì_ again... Xuhui going to learn on 2nd may too but her lesson is at 8am,123,28,7,yup ok go home look time msg ì xuhui go learn nd may lesson,59
ham,"Oops, I'll let you know when my roommate's done",47,9,1,oop ill let know roommat done,29
ham,I see the letter B on my car,28,8,1,see letter b car,16
ham,Anything lor... U decide...,27,4,7,anyth lor u decid,17
ham,Hello! How's you and how did saturday go? I was just texting to see if you'd decided to do anything tomo. Not that i'm trying to invite myself or anything!,155,30,2,hello how saturday go text see youd decid anyth tomo im tri invit anyth,71
ham,Pls go ahead with watts. I just wanted to be sure. Do have a great weekend. Abiola,82,17,4,pl go ahead watt want sure great weekend abiola,47
ham,"Did I forget to tell you ? I want you , I need you, I crave you ... But most of all ... I love you my sweet Arabian steed ... Mmmmmm ... Yummy",142,34,13,forget tell want need crave love sweet arabian steed mmmmmm yummi,65
spam,07732584351 - Rodger Burns - MSG = We tried to call you re your reply to our sms for a free nokia mobile + free camcorder. Please call now 08000930705 for delivery tomorrow,172,33,2,rodger burn msg tri call repli sm free nokia mobil free camcord pleas call deliveri tomorrow,92
ham,WHO ARE YOU SEEING?,19,4,1,see,3
ham,Great! I hope you like your man well endowed. I am  &lt;#&gt;  inches...,72,13,5,great hope like man well endow ltgt inch,40
ham,No calls..messages..missed calls,32,3,5,callsmessagesmiss call,22
ham,Didn't you get hep b immunisation in nigeria.,45,8,2,didnt get hep b immunis nigeria,31
ham,"Fair enough, anything going on?",31,5,1,fair enough anyth go,20
ham,"Yeah hopefully, if tyler can't do it I could maybe ask around a bit",67,14,1,yeah hope tyler cant could mayb ask around bit,46
ham,U don't know how stubborn I am. I didn't even want to go to the hospital. I kept telling Mark I'm not a weak sucker. Hospitals are for weak suckers.,148,30,5,u dont know stubborn didnt even want go hospit kept tell mark im weak sucker hospit weak sucker,95
ham,What you thinked about me. First time you saw me in class.,58,12,3,think first time saw class,26
ham,"A gram usually runs like  &lt;#&gt; , a half eighth is smarter though and gets you almost a whole second gram for  &lt;#&gt;",124,23,1,gram usual run like ltgt half eighth smarter though get almost whole second gram ltgt,85
ham,K fyi x has a ride early tomorrow morning but he's crashing at our place tonight,80,16,1,k fyi x ride earli tomorrow morn he crash place tonight,55
ham,"Wow. I never realized that you were so embarassed by your accomodations. I thought you liked it, since i was doing the best i could and you always seemed so happy about \the cave\"". I'm sorry I didn't and don't have more to give. I'm sorry i offered. I'm sorry your room was so embarassing.""",291,55,7,wow never realiz embarass accomod thought like sinc best could alway seem happi cave im sorri didnt dont give im sorri offer im sorri room embarass,147
spam,SMS. ac Sptv: The New Jersey Devils and the Detroit Red Wings play Ice Hockey. Correct or Incorrect? End? Reply END SPTV,120,22,3,sm ac sptv new jersey devil detroit red wing play ice hockey correct incorrect end repli end sptv,97
ham,Do you know what Mallika Sherawat did yesterday? Find out now @  &lt;URL&gt;,76,13,1,know mallika sherawat yesterday find lturlgt,44
spam,"Congrats! 1 year special cinema pass for 2 is yours. call 09061209465 now! C Suprman V, Matrix3, StarWars3, etc all 4 FREE! bx420-ip4-5we. 150pm. Dont miss out! ",161,27,4,congrat year special cinema pass call c suprman v matrix starwar etc free bxipw pm dont miss,92
ham,"Sorry, I'll call later in meeting.",34,6,2,sorri ill call later meet,25
ham,Tell where you reached,22,4,1,tell reach,10
ham,Yes..gauti and sehwag out of odi series.,40,7,4,yesgauti sehwag odi seri,24
ham,Your gonna have to pick up a $1 burger for yourself on your way home. I can't even move. Pain is killing me.,108,23,4,gonna pick burger way home cant even move pain kill,51
ham,Ha ha ha good joke. Girls are situation seekers.,48,9,3,ha ha ha good joke girl situat seeker,37
ham,Its a part of checking IQ,25,6,1,part check iq,13
ham,"Sorry my roommates took forever, it ok if I come by now?",56,12,1,sorri roommat took forev ok come,32
ham,Ok lar i double check wif da hair dresser already he said wun cut v short. He said will cut until i look nice.,110,24,3,ok lar doubl check wif da hair dresser alreadi said wun cut v short said cut look nice,86
spam,"As a valued customer, I am pleased to advise you that following recent review of your Mob No. you are awarded with a å£1500 Bonus Prize, call 09066364589",153,28,2,valu custom pleas advis follow recent review mob award å£ bonu prize call,73
ham,"Today is \song dedicated day..\"" Which song will u dedicate for me? Send this to all ur valuable frnds but first rply me...""",124,23,6,today song dedic day song u dedic send ur valuabl frnd first rpli,65
spam,"Urgent UR awarded a complimentary trip to EuroDisinc Trav, Aco&Entry41 Or å£1000. To claim txt DIS to 87121 18+6*å£1.50(moreFrmMob. ShrAcomOrSglSuplt)10, LS1 3AJ",161,22,4,urgent ur award complimentari trip eurodisinc trav acoentri å£ claim txt di å£morefrmmob shracomorsglsuplt ls aj,112
spam,"Did you hear about the new \Divorce Barbie\""? It comes with all of Ken's stuff!""",80,15,1,hear new divorc barbi come ken stuff,36
ham,I plane to give on this month end.,34,8,2,plane give month end,20
ham,Wah lucky man... Then can save money... Hee...,46,8,10,wah lucki man save money hee,28
ham,Finished class where are you.,29,5,2,finish class,12
ham,HI BABE IM AT HOME NOW WANNA DO SOMETHING? XX,45,10,1,hi babe im home wanna someth xx,31
ham,K..k:)where are you?how did you performed?,42,6,3,kkwhere youhow perform,22
ham,U can call me now...,20,5,4,u call,6
ham,I am waiting machan. Call me once you free.,43,9,3,wait machan call free,21
ham,Thats cool. i am a gentleman and will treat you with dignity and respect.,73,14,3,that cool gentleman treat digniti respect,41
ham,I like you peoples very much:) but am very shy pa.,50,11,2,like peopl much shi pa,22
ham,Does not operate after  &lt;#&gt;  or what,42,7,1,oper ltgt,9
ham,Its not the same here. Still looking for a job. How much do Ta's earn there.,76,16,4,still look job much ta earn,27
ham,"Sorry, I'll call later",22,4,1,sorri ill call later,20
ham,K. Did you call me just now ah? ,32,8,2,k call ah,9
ham,Ok i am on the way to home hi hi,32,10,1,ok way home hi hi,17
ham,You will be in the place of that man,36,9,1,place man,9
ham,Yup next stop.,14,3,2,yup next stop,13
ham,"I call you later, don't have network. If urgnt, sms me.",55,11,3,call later dont network urgnt sm,32
ham,For real when u getting on yo? I only need 2 more tickets and one more jacket and I'm done. I already used all my multis.,121,26,3,real u get yo need ticket one jacket im done alreadi use multi,62
ham,Yes I started to send requests to make it but pain came back so I'm back in bed. Double coins at the factory too. I gotta cash in all my nitros.,144,31,4,ye start send request make pain came back im back bed doubl coin factori gotta cash nitro,89
ham,I'm really not up to it still tonight babe,42,9,1,im realli still tonight babe,28
ham,"Ela kano.,il download, come wen ur free..",41,7,4,ela kanoil download come wen ur free,36
ham,Yeah do! DonÛ÷t stand to close tho- youÛ÷ll catch something!,62,10,1,yeah donû÷t stand close tho youû÷ll catch someth,50
ham,Sorry to be a pain. Is it ok if we meet another night? I spent late afternoon in casualty and that means i haven't done any of y stuff42moro and that includes all my time sheets and that. Sorry. ,195,39,4,sorri pain ok meet anoth night spent late afternoon casualti mean havent done stuffmoro includ time sheet sorri,111
ham,Smile in Pleasure Smile in Pain Smile when trouble pours like Rain Smile when sum1 Hurts U Smile becoz SOMEONE still Loves to see u Smiling!!,141,26,1,smile pleasur smile pain smile troubl pour like rain smile sum hurt u smile becoz someon still love see u smile,111
spam,Please call our customer service representative on 0800 169 6031 between 10am-9pm as you have WON a guaranteed å£1000 cash or å£5000 prize!,139,23,1,pleas call custom servic repres ampm guarante å£ cash å£ prize,62
ham,Havent planning to buy later. I check already lido only got 530 show in e afternoon. U finish work already?,107,20,3,havent plan buy later check alreadi lido got show e afternoon u finish work alreadi,83
spam,"Your free ringtone is waiting to be collected. Simply text the password \MIX\"" to 85069 to verify. Get Usher and Britney. FML",125,22,4,free rington wait collect simpli text password mix verifi get usher britney fml,79
ham,Watching telugu movie..wat abt u?,33,5,3,watch telugu moviewat abt u,27
ham,i see. When we finish we have loads of loans to pay,51,12,2,see finish load loan pay,24
ham,"Hi. Wk been ok - on hols now! Yes on for a bit of a run. Forgot that i have hairdressers appointment at four so need to get home n shower beforehand. Does that cause prob for u?\""ham""",184,39,4,hi wk ok hol ye bit run forgot hairdress appoint four need get home n shower beforehand caus prob u ham,103
ham,Please don't text me anymore. I have nothing else to say.,57,11,3,pleas dont text anymor noth els say,35
ham,Okay name ur price as long as its legal! Wen can I pick them up? Y u ave x ams xx,81,21,1,okay name ur price long legal wen pick u ave x am xx,52
ham,I'm still looking for a car to buy. And have not gone 4the driving test yet.,76,16,3,im still look car buy gone drive test yet,41
ham,"wow. You're right! I didn't mean to do that. I guess once i gave up on boston men and changed my search location to nyc, something changed. Cuz on my signin page it still says boston.",183,36,5,wow your right didnt mean guess gave boston men chang search locat nyc someth chang cuz signin page still say boston,116
ham,Umma my life and vava umma love you lot dear,44,10,1,umma life vava umma love lot dear,33
ham,Thanks a lot for your wishes on my birthday. Thanks you for making my birthday truly memorable.,95,17,3,thank lot wish birthday thank make birthday truli memor,55
ham,"Aight, I'll hit you up when I get some cash",43,10,1,aight ill hit get cash,22
ham,How would my ip address test that considering my computer isn't a minecraft server,82,14,1,would ip address test consid comput isnt minecraft server,57
ham,I know! Grumpy old people. My mom was like you better not be lying. Then again I am always the one to play jokes...,115,24,6,know grumpi old peopl mom like better lie alway one play joke,61
ham,Dont worry. I guess he's busy.,30,6,3,dont worri guess he busi,24
ham,What is the plural of the noun research?,40,8,1,plural noun research,20
ham,Going for dinner.msg you after.,31,5,3,go dinnermsg,12
ham,I'm ok wif it cos i like 2 try new things. But i scared u dun like mah. Cos u said not too loud.,96,24,4,im ok wif co like tri new thing scare u dun like mah co u said loud,67
spam,GENT! We are trying to contact you. Last weekends draw shows that you won a å£1000 prize GUARANTEED. Call 09064012160. Claim Code K52. Valid 12hrs only. 150ppm,159,27,6,gent tri contact last weekend draw show å£ prize guarante call claim code k valid hr ppm,88
ham,"Wa, ur openin sentence very formal... Anyway, i'm fine too, juz tt i'm eatin too much n puttin on weight...Haha... So anythin special happened?",143,24,10,wa ur openin sentenc formal anyway im fine juz tt im eatin much n puttin weighthaha anythin special happen,106
ham,"As I entered my cabin my PA said, '' Happy B'day Boss !!''. I felt special. She askd me 4 lunch. After lunch she invited me to her apartment. We went there.",156,32,6,enter cabin pa said happi bday boss felt special askd lunch lunch invit apart went,82
spam,You are a winner U have been specially selected 2 receive å£1000 or a 4* holiday (flights inc) speak to a live operator 2 claim 0871277810910p/min (18+) ,153,27,1,winner u special select receiv å£ holiday flight inc speak live oper claim pmin,79
ham,Goodo! Yes we must speak friday - egg-potato ratio for tortilla needed! ,72,12,1,goodo ye must speak friday eggpotato ratio tortilla need,56
ham,Hmm...my uncle just informed me that he's paying the school directly. So pls buy food.,86,15,6,hmmmi uncl inform he pay school directli pl buy food,52
spam,PRIVATE! Your 2004 Account Statement for 07742676969 shows 786 unredeemed Bonus Points. To claim call 08719180248 Identifier Code: 45239 Expires,144,20,2,privat account statement show unredeem bonu point claim call identifi code expir,80
spam,"URGENT! Your Mobile No. was awarded å£2000 Bonus Caller Prize on 5/9/03 This is our final try to contact U! Call from Landline 09064019788 BOX42WR29C, 150PPM",157,26,2,urgent mobil award å£ bonu caller prize final tri contact u call landlin boxwrc ppm,83
ham,here is my new address -apples&pairs&all that malarky,53,8,1,new address applespairsal malarki,33
spam,Todays Voda numbers ending 7548 are selected to receive a $350 award. If you have a match please call 08712300220 quoting claim code 4041 standard rates app,156,27,2,today voda number end select receiv award match pleas call quot claim code standard rate app,92
ham,I am going to sao mu today. Will be done only at 12 ,52,13,2,go sao mu today done,20
ham,ÌÏ predict wat time Ì_'ll finish buying?,40,7,1,ìï predict wat time ìll finish buy,34
ham,"Good stuff, will do.",20,4,2,good stuff,10
ham,"Just so that you know,yetunde hasn't sent money yet. I just sent her a text not to bother sending. So its over, you dont have to involve yourself in anything. I shouldn't have imposed anything on you in the first place so for that, i apologise.",244,46,5,knowyetund hasnt sent money yet sent text bother send dont involv anyth shouldnt impos anyth first place apologis,113
ham,Are you there in room.,22,5,2,room,4
ham,HEY GIRL. HOW R U? HOPE U R WELL ME AN DEL R BAK! AGAIN LONG TIME NO C! GIVE ME A CALL SUM TIME FROM LUCYxx,107,27,2,hey girl r u hope u r well del r bak long time c give call sum time lucyxx,74
ham,K..k:)how much does it cost?,28,5,3,kkhow much cost,15
ham,I'm home.,9,2,2,im home,7
ham,"Dear, will call Tmorrow.pls accomodate.",39,5,3,dear call tmorrowpl accomod,27
ham,First answer my question.,25,4,2,first answer question,21
spam,Sunshine Quiz Wkly Q! Win a top Sony DVD player if u know which country the Algarve is in? Txt ansr to 82277. å£1.50 SP:Tyrone,126,25,3,sunshin quiz wkli q win top soni dvd player u know countri algarv txt ansr å£ sptyron,85
spam,Want 2 get laid tonight? Want real Dogging locations sent direct 2 ur mob? Join the UK's largest Dogging Network bt Txting GRAVEL to 69888! Nt. ec2a. 31p.msg@150p,162,28,4,want get laid tonight want real dog locat sent direct ur mob join uk largest dog network bt txting gravel nt eca pmsgp,118
ham,I only haf msn. It's yijue@hotmail.com,38,6,3,haf msn yijuehotmailcom,23
ham,He is there. You call and meet him,34,8,2,call meet,9
ham,No no. I will check all rooms befor activities,46,9,2,check room befor activ,22
spam,You'll not rcv any more msgs from the chat svc. For FREE Hardcore services text GO to: 69988 If u get nothing u must Age Verify with yr network & try again,155,32,2,youll rcv msg chat svc free hardcor servic text go u get noth u must age verifi yr network tri,94
ham,Got c... I lazy to type... I forgot Ì_ in lect... I saw a pouch but like not v nice...,86,20,13,got c lazi type forgot ì lect saw pouch like v nice,51
ham,"K, text me when you're on the way",33,8,1,k text your way,15
ham,"Sir, Waiting for your mail.",27,5,2,sir wait mail,13
ham,"A swt thought: \Nver get tired of doing little things 4 lovable persons..\"" Coz..somtimes those little things occupy d biggest part in their Hearts.. Gud ni8""",158,26,7,swt thought nver get tire littl thing lovabl person cozsomtim littl thing occupi biggest part heart gud ni,106
ham,I know you are. Can you pls open the back?,42,10,2,know pl open back,17
ham,Yes see ya not on the dot,25,7,1,ye see ya dot,13
ham,Whats the staff name who is taking class for us?,48,10,1,what staff name take class us,29
spam,"FreeMsg Why haven't you replied to my text? I'm Randy, sexy, female and live local. Luv to hear from u. Netcollex Ltd 08700621170150p per msg reply Stop to end",159,29,3,freemsg havent repli text im randi sexi femal live local luv hear u netcollex ltd p per msg repli stop end,106
ham,Ummma.will call after check in.our life will begin from qatar so pls pray very hard.,84,15,4,ummmawil call check inour life begin qatar pl pray hard,55
ham,K..i deleted my contact that why?,33,6,3,ki delet contact,16
ham,Sindu got job in birla soft ..,30,7,3,sindu got job birla soft,24
ham,The wine is flowing and i'm i have nevering..,45,9,3,wine flow im never,18
ham,Yup i thk cine is better cos no need 2 go down 2 plaza mah.,59,15,2,yup thk cine better co need go plaza mah,40
ham,Ok... Ur typical reply...,25,4,7,ok ur typic repli,17
ham,"You are everywhere dirt, on the floor, the windows, even on my shirt. And sometimes when i open my mouth, you are all that comes flowing out. I dream of my world without you, then half my chores are out too. A time of joy for me, lots of tv shows i.ll see. But i guess like all things you just must exist, like rain, hail and mist, and when my time here is done, you and i become one.",384,80,7,everywher dirt floor window even shirt sometim open mouth come flow dream world without half chore time joy lot tv show ill see guess like thing must exist like rain hail mist time done becom one,195
ham,Aaooooright are you at work?,28,5,1,aaooooright work,16
ham,I'm leaving my house now...,27,5,4,im leav hous,12
ham,"Hello, my love. What are you doing? Did you get to that interview today? Are you you happy? Are you being a good boy? Do you think of me?Are you missing me ?",157,33,2,hello love get interview today happi good boy think mear miss,61
spam,Customer service annoncement. You have a New Years delivery waiting for you. Please call 07046744435 now to arrange delivery,124,19,3,custom servic annonc new year deliveri wait pleas call arrang deliveri,70
spam,You are a winner U have been specially selected 2 receive å£1000 cash or a 4* holiday (flights inc) speak to a live operator 2 claim 0871277810810,146,27,1,winner u special select receiv å£ cash holiday flight inc speak live oper claim,79
ham,Keep yourself safe for me because I need you and I miss you already and I envy everyone that see's you in real life,115,24,1,keep safe need miss alreadi envi everyon see real life,54
ham,New car and house for my parents.:)i have only new job in hand:),64,13,2,new car hous parentsi new job hand,34
ham,I'm so in love with you. I'm excited each day i spend with you. You make me so happy.,85,19,4,im love im excit day spend make happi,37
spam,-PLS STOP bootydelious (32/F) is inviting you to be her friend. Reply YES-434 or NO-434 See her: www.SMS.ac/u/bootydelious STOP? Send STOP FRND to 62468,152,24,4,pl stop bootydeli f invit friend repli ye see stop send stop frnd,65
spam,"BangBabes Ur order is on the way. U SHOULD receive a Service Msg 2 download UR content. If U do not, GoTo wap. bangb. tv on UR mobile internet/service menu",155,30,5,bangbab ur order way u receiv servic msg download ur content u goto wap bangb tv ur mobil internetservic menu,109
ham,I place all ur points on e cultures module already.,51,10,2,place ur point e cultur modul alreadi,37
