Label,Message,Message_Length,Word_Count,Sentence_Count,Transformed_Message,Clean_Length
ham,do u think that any girl will propose u today by seing ur bloody funky shit fucking face...............asssssholeeee................,132,18,32,u think girl propos u today se ur bloodi funki shit fuck faceasssssholeee,73
ham,I wish u were here. I feel so alone,35,9,2,wish u feel alon,16
ham,Reason is if the team budget is available at last they buy the unsold players for at base rate..,96,19,3,reason team budget avail last buy unsold player base rate,57
ham,CERI U REBEL! SWEET DREAMZ ME LITTLE BUDDY!! C YA 2MORO! WHO NEEDS BLOKES,73,14,1,ceri u rebel sweet dreamz littl buddi c ya moro need bloke,58
spam,ringtoneking 84484,18,2,1,ringtonek,9
ham,Huh i cant thk of more oredi how many pages do we have?,55,13,1,huh cant thk oredi mani page,28
ham,His frens go then he in lor. Not alone wif my mum n sis lor.,60,15,3,fren go lor alon wif mum n si lor,33
ham,Nationwide auto centre (or something like that) on Newport road. I liked them there,83,14,2,nationwid auto centr someth like newport road like,50
ham,"Hey, I missed you tm of last night as my phone was on the charge ... *smiles* ... I am meeting a friend shortly",111,24,7,hey miss tm last night phone charg smile meet friend shortli,60
ham,"Whatever, juliana. Do whatever you want.",40,6,3,whatev juliana whatev want,26
spam,Ringtone Club: Gr8 new polys direct to your mobile every week !,63,12,1,rington club gr new poli direct mobil everi week,48
ham,"Hello. Sort of out in town already. That . So dont rush home, I am eating nachos. Will let you know eta.",104,22,6,hello sort town alreadi dont rush home eat nacho let know eta,61
ham,Ok lor. Anyway i thk we cant get tickets now cos like quite late already. U wan 2 go look 4 ur frens a not? Darren is wif them now...,133,30,6,ok lor anyway thk cant get ticket co like quit late alreadi u wan go look ur fren darren wif,92
spam,(Bank of Granite issues Strong-Buy) EXPLOSIVE PICK FOR OUR MEMBERS *****UP OVER 300% *********** Nasdaq Symbol CDGT That is a $5.00 per..,137,22,4,bank granit issu strongbuy explos pick member nasdaq symbol cdgt per,68
ham,"Dizzamn, aight I'll ask my suitemates when I get back",53,10,1,dizzamn aight ill ask suitem get back,37
ham,"Nimbomsons. Yep phone knows that one. Obviously, cos thats a real word",70,12,3,nimbomson yep phone know one obvious co that real word,54
ham,I love to cuddle! I want to hold you in my strong arms right now...,67,15,4,love cuddl want hold strong arm right,37
ham,R u in this continent?,22,5,1,r u contin,10
ham,We'll you pay over like  &lt;#&gt; yrs so its not too difficult,63,12,1,well pay like ltgt yr difficult,31
spam,Bored housewives! Chat n date now! 0871750.77.11! BT-national rate 10p/min only from landlines!,95,13,3,bore housew chat n date btnation rate pmin landlin,50
spam,We tried to call you re your reply to our sms for a video mobile 750 mins UNLIMITED TEXT free camcorder Reply or call now 08000930705 Del Thurs,143,28,1,tri call repli sm video mobil min unlimit text free camcord repli call del thur,79
ham,K...k...when will you give treat?,33,5,7,kkwhen give treat,17
spam,"This is the 2nd time we have tried to contact u. U have won the å£400 prize. 2 claim is easy, just call 087104711148 NOW! Only 10p per minute. BT-national-rate",159,30,4,nd time tri contact u u å£ prize claim easi call p per minut btnationalr,72
ham,He's just gonna worry for nothing. And he won't give you money its no use.,74,15,3,he gonna worri noth wont give money use,39
ham,Did you get any gift? This year i didnt get anything. So bad,60,13,2,get gift year didnt get anyth bad,33
ham,Well there's a pattern emerging of my friends telling me to drive up and come smoke with them and then telling me that I'm a weed fiend/make them smoke too much/impede their doing other things so you see how I'm hesitant,220,41,1,well there pattern emerg friend tell drive come smoke tell im weed fiendmak smoke muchimped thing see im hesit,110
ham,", ow u dey.i paid 60,400thousad.i told  u would call . ",55,11,4,ow u deyi paid thousadi told u would call,41
ham,IM FINE BABES AINT BEEN UP 2 MUCH THO! SAW SCARY MOVIE YEST ITS QUITE FUNNY! WANT 2MRW AFTERNOON? AT TOWN OR MALL OR SUMTHIN?xx,127,25,1,im fine babe aint much tho saw scari movi yest quit funni want mrw afternoon town mall sumthinxx,96
ham,I'm reaching home in 5 min.,27,6,2,im reach home min,17
ham,"Forgot you were working today! Wanna chat, but things are ok so drop me a text when you're free / bored etc and i'll ring. Hope all is well, nose essay and all xx",162,34,2,forgot work today wanna chat thing ok drop text your free bore etc ill ring hope well nose essay xx,99
ham,Ha... Then we must walk to everywhere... Cannot take tram. My cousin said can walk to vic market from our hotel ,112,21,8,ha must walk everywher cannot take tram cousin said walk vic market hotel,73
ham,Discussed with your mother ah?,30,5,1,discuss mother ah,17
ham,"Sorry, I can't text &amp; drive coherently, see you in twenty",61,11,1,sorri cant text amp drive coher see twenti,42
spam,You will be receiving this week's Triple Echo ringtone shortly. Enjoy it!,73,12,2,receiv week tripl echo rington shortli enjoy,44
ham,In which place i can get rooms cheap:-),39,8,1,place get room cheap,20
ham,Eek that's a lot of time especially since American Pie is like 8 minutes long. I can't stop singing it.,103,20,3,eek that lot time especi sinc american pie like minut long cant stop sing,73
ham,"\GRAN ONLYFOUND OUT AFEW DAYS AGO.CUSOON HONI\""""",48,7,2,gran onlyfound afew day agocusoon honi,38
spam,"U've been selected to stay in 1 of 250 top British hotels - FOR NOTHING! Holiday valued at å£350! Dial 08712300220 to claim - National Rate Call. Bx526, SW73SS",159,29,2,uve select stay top british hotel noth holiday valu å£ dial claim nation rate call bx swss,90
ham,University of southern california.,34,4,2,univers southern california,27
ham,We have to pick rayan macleran there.,37,7,2,pick rayan macleran,19
ham,U gd lor go shopping i got stuff to do. U wan 2 watch infernal affairs a not? Come lar...,89,20,5,u gd lor go shop got stuff u wan watch infern affair come lar,61
ham,Well. Balls. Time to make calls,31,6,3,well ball time make call,24
ham,Wat time Ì_ wan today?,22,5,1,wat time ì wan today,20
ham, &lt;#&gt;  in mca. But not conform.,36,6,3,ltgt mca conform,16
ham,Oh ok.. Wat's ur email?,23,5,3,oh ok wat ur email,18
ham,"Yes, princess. Are you going to make me moan?",45,9,2,ye princess go make moan,24
ham,Lol its ok I didn't remember til last nite,42,9,1,lol ok didnt rememb til last nite,33
ham,"[Û_] anyway, many good evenings to u! s",40,8,1,û anyway mani good even u,26
ham,"Cool, I'll text you in a few",28,7,1,cool ill text,13
ham,"Sorry vikky, i'm Watching olave mandara movie kano in trishul theatre wit my frnds..",84,14,3,sorri vikki im watch olav mandara movi kano trishul theatr wit frnd,67
ham,I'm very happy for you babe ! Woo hoo party on dude!,52,12,1,im happi babe woo hoo parti dude,32
ham,I am taking you for italian food. How about a pretty dress with no panties? :),78,16,2,take italian food pretti dress panti,36
ham,Wot u up 2? Thout u were gonna call me!! Txt bak luv K,54,14,1,wot u thout u gonna call txt bak luv k,38
spam,YOU ARE CHOSEN TO RECEIVE A å£350 AWARD! Pls call claim number 09066364311 to collect your award which you are selected to receive as a valued mobile customer.,159,28,2,chosen receiv å£ award pl call claim number collect award select receiv valu mobil custom,89
ham,How are you holding up?,23,5,1,hold,4
ham,Dont flatter yourself... Tell that man of mine two pints of carlin in ten minutes please.... ,93,16,8,dont flatter tell man mine two pint carlin ten minut pleas,58
ham,Hope you are not scared!,24,5,1,hope scare,10
ham,I'm at home n ready...,22,5,4,im home n readi,15
ham,What time do u get out?,23,6,1,time u get,10
ham,I am literally in bed and have been up for like  &lt;#&gt;  hours,65,13,1,liter bed like ltgt hour,24
ham,"Yes, my reg is  Ciao!",21,5,1,ye reg ciao,11
ham,If You mean the website. Yes.,29,6,3,mean websit ye,14
spam,Win a å£1000 cash prize or a prize worth å£5000,47,10,1,win å£ cash prize prize worth å£,32
spam,"Thanks for your ringtone order, reference number X49.Your mobile will be charged 4.50. Should your tone not arrive please call customer services 09065989182",156,23,4,thank rington order refer number xyour mobil charg tone arriv pleas call custom servic,86
ham,Lol or I could just starve and lose a pound by the end of the day.,66,16,2,lol could starv lose pound end day,34
ham,Yeah that's the impression I got,32,6,1,yeah that impress got,21
ham,Ok ok take care. I can understand.,34,7,3,ok ok take care understand,26
ham,"Motivate Behind every darkness, there is a shining light waiting for you to find it... Behind every best friend, there is always trust and love... BSLVYL",153,26,7,motiv behind everi dark shine light wait find behind everi best friend alway trust love bslvyl,94
ham,"Ya ok, then had dinner?",23,5,1,ya ok dinner,12
ham,I was slept that time.you there?,32,6,2,slept timey,11
ham,dont make ne plans for nxt wknd coz she wants us to come down then ok,69,16,1,dont make ne plan nxt wknd coz want us come ok,46
ham,When is school starting. Where will you stay. What's the weather like. And the food. Do you have a social support system like friends in the school. All these things are important.,180,32,7,school start stay what weather like food social support system like friend school thing import,94
ham,"Ha ha nan yalrigu heltini..Iyo kothi chikku, u shared many things wit me..so far i didn't told any body and even uttered a word abt u.. If ur trusting me so much how can i tell these to others.. Plz nxt time dont use those words to me..ok, chikku:-);-)B-)",255,49,11,ha ha nan yalrigu heltiniiyo kothi chikku u share mani thing wit meso far didnt told bodi even utter word abt u ur trust much tell other plz nxt time dont use word meok chikkub,176
ham,Noice. Text me when you're here,31,6,2,noic text your,14
ham,Hi di is yijue we're meeting at 7 pm at esaplanade tonight.,59,12,2,hi di yiju meet pm esaplanad tonight,36
spam,Moby Pub Quiz.Win a å£100 High Street prize if u know who the new Duchess of Cornwall will be? Txt her first name to 82277.unsub STOP å£1.50 008704050406 SP,156,29,4,mobi pub quizwin å£ high street prize u know new duchess cornwal txt first name unsub stop å£ sp,96
spam,"This weeks SavaMob member offers are now accessible. Just call 08709501522 for details! SavaMob, POBOX 139, LA3 2WU. Only å£1.50/week. SavaMob - offers mobile!",159,24,5,week savamob member offer access call detail savamob pobox la wu å£week savamob offer mobil,91
ham,"Aight I've been set free, think you could text me blake's address? It occurs to me I'm not quite as sure what I'm doing as I thought I was",138,29,1,aight ive set free think could text blake address occur im quit sure im thought,79
ham,Hi dear we saw dear. We both are happy. Where you my battery is low,67,15,3,hi dear saw dear happi batteri low,34
ham,How are you. Its been ages. How's abj,37,8,3,age how abj,11
ham,Prof: you have passed in all the papers in this sem congrats . . . . Student: Enna kalaachutaarama..!! Prof:???? Gud mrng!,122,22,7,prof pass paper sem congrat student enna kalaachutaarama prof gud mrng,70
ham,Dont kick coco when he's down,29,6,1,dont kick coco he,17
ham,Fyi I'm gonna call you sporadically starting at like  &lt;#&gt;  bc we are not not doin this shit,97,18,1,fyi im gonna call sporad start like ltgt bc doin shit,53
spam,"You are being contacted by our Dating Service by someone you know! To find out who it is, call from your mobile or landline 09064017305 PoBox75LDNS7 ",149,26,1,contact date servic someon know find call mobil landlin poboxldn,64
spam,TBS/PERSOLVO. been chasing us since Sept forå£38 definitely not paying now thanks to your information. We will ignore them. Kath. Manchester.,141,21,6,tbspersolvo chase us sinc sept forå£ definit pay thank inform ignor kath manchest,81
ham,Hope youåÕre not having too much fun without me!! see u tomorrow love jess x,76,15,1,hope youåõr much fun without see u tomorrow love jess x,55
ham,Ok i wont call or disturb any one. I know all are avoiding me. I am a burden for all,84,20,3,ok wont call disturb one know avoid burden,42
ham,I've reached home n i bathe liao... U can call me now...,56,12,7,ive reach home n bath liao u call,33
spam,Loans for any purpose even if you have Bad Credit! Tenants Welcome. Call NoWorriesLoans.com on 08717111821,106,16,3,loan purpos even bad credit tenant welcom call noworriesloanscom,64
ham,Was the actual exam harder than NBME,36,7,1,actual exam harder nbme,23
ham,A lot of this sickness thing going round. Take it easy. Hope u feel better soon. Lol,84,17,4,lot sick thing go round take easi hope u feel better soon lol,61
spam,87077: Kick off a new season with 2wks FREE goals & news to ur mobile! Txt ur club name to 87077 eg VILLA to 87077,114,25,1,kick new season wk free goal news ur mobil txt ur club name eg villa,68
ham,Hey sathya till now we dint meet not even a single time then how can i saw the situation sathya.,96,20,2,hey sathya till dint meet even singl time saw situat sathya,59
ham,Gam gone after outstanding innings.,35,5,2,gam gone outstand inning,24
ham,O i played smash bros  &lt;#&gt;  religiously.,46,7,2,play smash bro ltgt religi,26
ham,"Sir, good morning. Hope you had a good weekend. I called to let you know that i was able to raise  &lt;#&gt;  from my dad. He however said he would make the rest available by mid feb. This amount is still quite short and i was hoping you would help. Do have a good day. Abiola",276,56,7,sir good morn hope good weekend call let know abl rais ltgt dad howev said would make rest avail mid feb amount still quit short hope would help good day abiola,160
ham,Hurry home. Soup is DONE!,25,5,2,hurri home soup done,20
ham,"Good afternoon, my love. It was good to see your words on YM and get your tm. Very smart move, my slave ... *smiles* ... I drink my coffee and await you.",153,32,10,good afternoon love good see word ym get tm smart move slave smile drink coffe await,84
ham,Quite ok but a bit ex... U better go eat smth now else i'll feel guilty...,74,16,7,quit ok bit ex u better go eat smth els ill feel guilti,55
spam,"Orange brings you ringtones from all time Chart Heroes, with a free hit each week! Go to Ringtones & Pics on wap. To stop receiving these tips reply STOP.",154,29,3,orang bring rington time chart hero free hit week go rington pic wap stop receiv tip repli stop,95
ham,Lemme know when you're here,27,5,1,lemm know your,14
spam,PRIVATE! Your 2003 Account Statement for 07973788240 shows 800 un-redeemed S. I. M. points. Call 08715203649 Identifier Code: 40533 Expires 31/10/04,148,21,5,privat account statement show unredeem point call identifi code expir,69
ham,He needs to stop going to bed and make with the fucking dealing,63,13,1,need stop go bed make fuck deal,31
ham,"How are you, my Love ? Are you with your brother ? Time to talk english with him ? *grins* Say : Hey Muhommad, Penny says hello from across the sea",147,31,1,love brother time talk english grin say hey muhommad penni say hello across sea,79
spam,We tried to call you re your reply to our sms for a video mobile 750 mins UNLIMITED TEXT + free camcorder Reply of call 08000930705 Now,135,27,1,tri call repli sm video mobil min unlimit text free camcord repli call,70
ham,"Hey doc pls I want to get nice t shirt for my hubby nice fiting ones my budget is  &lt;#&gt; k help pls I will load d card abi hw,keep me posted luv. 2 mj",154,35,2,hey doc pl want get nice shirt hubbi nice fite one budget ltgt k help pl load card abi hwkeep post luv mj,105
ham,I remain unconvinced that this isn't an elaborate test of my willpower,70,12,1,remain unconvinc isnt elabor test willpow,41
ham,"\Life is nothing wen v get everything\"". But \""life is everything wen v miss something \"". Real value of people wil be realized only in their absence.... gud mrng""",163,29,7,life noth wen v get everyth life everyth wen v miss someth real valu peopl wil realiz absenc gud mrng,101
ham,how are you? I miss you!,24,6,1,miss,4
ham,I ain't answerin no phone at what is actually a pretty reasonable hour but I'm sleepy,85,16,1,aint answerin phone actual pretti reason hour im sleepi,55
ham,"Hey , is * rite u put åÈ10 evey mnth is that all?",49,13,1,hey rite u put åè evey mnth,27
ham,i am going to bed now prin,26,7,1,go bed prin,11
ham,I think just yourself Û_Thanks and see you tomo,48,9,1,think ûthank see tomo,22
ham,If u dun drive then how i go 2 sch.,35,10,2,u dun drive go sch,18
ham,I not at home now lei...,24,6,4,home lei,8
spam,GSOH? Good with SPAM the ladies?U could b a male gigolo? 2 join the uk's fastest growing mens club reply ONCALL. mjzgroup. 08714342399.2stop reply STOP. msg@å£1.50rcvd,167,26,6,gsoh good spam ladiesu could b male gigolo join uk fastest grow men club repli oncal mjzgroup stop repli stop msgå£rcvd,119
ham,Do u hav any frnd by name ashwini in ur college?,48,11,1,u hav frnd name ashwini ur colleg,33
ham,Jus finish my lunch on my way home lor... I tot u dun wan 2 stay in sch today...,80,19,7,ju finish lunch way home lor tot u dun wan stay sch today,57
ham,K then 2marrow are you coming to class.,39,8,2,k marrow come class,19
spam,"HOT LIVE FANTASIES call now 08707500020 Just 20p per min NTT Ltd, PO Box 1327 Croydon CR9 5WB 0870 is a national rate call",122,24,1,hot live fantasi call p per min ntt ltd po box croydon cr wb nation rate call,77
ham,Pls send me your address sir.,29,6,2,pl send address sir,19
ham,I want to lick your pussy now...,32,7,4,want lick pussi,15
ham,"Yo, you gonna still be in stock tomorrow/today? I'm trying to get a dubsack",75,14,1,yo gonna still stock tomorrowtoday im tri get dubsack,53
spam,URGENT! Your Mobile number has been awarded a <UKP>2000 prize GUARANTEED. Call 09061790125 from landline. Claim 3030. Valid 12hrs only 150ppm,141,21,4,urgent mobil number award prize guarante call landlin claim valid hr ppm,72
ham,"I'll see, but prolly yeah",25,5,1,ill see prolli yeah,19
ham,Thought we could go out for dinner. I'll treat you! Seem ok?,60,12,2,thought could go dinner ill treat seem ok,41
ham,Where are you ? What do you do ? How can you stand to be away from me ? Doesn't your heart ache without me ? Don't you wonder of me ? Don't you crave me ?,154,37,1,stand away doesnt heart ach without dont wonder dont crave,58
ham,Sorry. You never hear unless you book it. One was kinda a joke--thet were really looking for skinny white girls. The other was one line--you can only do so much on camera with that. Something like that they're casting on the look.,230,42,6,sorri never hear unless book one kinda jokethet realli look skinni white girl one liney much camera someth like theyr cast look,127
ham,"Sure thing big man. i have hockey elections at 6, shouldnÛ÷t go on longer than an hour though",94,18,2,sure thing big man hockey elect shouldnû÷t go longer hour though,65
ham,Watch lor. I saw a few swatch one i thk quite ok. Ard 116 but i need 2nd opinion leh...,87,20,6,watch lor saw swatch one thk quit ok ard need nd opinion leh,60
ham,Hiya do u like the hlday pics looked horrible in them so took mo out! Hows the camp Amrca thing? Speak soon Serena:),116,23,1,hiya u like hlday pic look horribl took mo how camp amrca thing speak soon serena,81
ham,"Babe! How goes that day ? What are you up to ? I miss you already, my Love ... * loving kiss* ... I hope everything goes well.",126,28,8,babe goe day miss alreadi love love kiss hope everyth goe well,62
ham,Yunny... I'm goin to be late,28,6,4,yunni im goin late,18
ham,Doc prescribed me morphine cause the other pain meds aren't enough. Waiting for my mom to bring it. That med should kick in fast so I'm gonna try to be on later,160,32,3,doc prescrib morphin caus pain med arent enough wait mom bring med kick fast im gonna tri later,95
ham,"Cool, want me to go to kappa or should I meet you outside mu",60,14,1,cool want go kappa meet outsid mu,33
ham,"Hey sexy buns ! Have I told you ? I adore you, loverboy. I hope you remember to thank your sister in law for those meatballs *grins* ... i love you, babe",153,32,5,hey sexi bun told ador loverboy hope rememb thank sister law meatbal grin love babe,83
ham,May b approve panalam...but it should have more posts..,55,9,6,may b approv panalambut post,28
spam,"SPJanuary Male Sale! Hot Gay chat now cheaper, call 08709222922. National rate from 1.5p/min cheap to 7.8p/min peak! To stop texts call 08712460324 (10p/min)",157,24,4,spjanuari male sale hot gay chat cheaper call nation rate pmin cheap pmin peak stop text call pmin,98
ham,Me i'm not workin. Once i get job...,36,8,5,im workin get job,17
ham,And by when you're done I mean now,34,8,1,your done mean,14
ham,\Its Ur luck to Love someone. Its Ur fortune to Love the one who Loves U. But,77,17,3,ur luck love someon ur fortun love one love u,45
ham,Hi baby ive just got back from work and i was wanting to see u allday! I hope i didnt piss u off on the phone today. If u are up give me a call xxx,147,36,2,hi babi ive got back work want see u allday hope didnt piss u phone today u give call xxx,89
spam,FreeMsg Today's the day if you are ready! I'm horny & live in your town. I love sex fun & games! Netcollex Ltd 08700621170150p per msg reply Stop to end,152,30,2,freemsg today day readi im horni live town love sex fun game netcollex ltd p per msg repli stop end,99
ham,Is it your yahoo boys that bring in the perf? Or legal.,55,12,2,yahoo boy bring perf legal,26
ham,No need to say anything to me. I know i am an outsider,54,13,2,need say anyth know outsid,26
ham,have you ever had one foot before?,34,7,1,ever one foot,13
ham,Just got to  &lt;#&gt;,22,4,1,got ltgt,8
ham,"Good! No, donÛ÷t need any receiptsÛÓwell done! (Û_) Yes, please tell . WhatÛ÷s her number, i could ring her",111,19,2,good donû÷t need receiptsûówel done û ye pleas tell whatû÷ number could ring,80
ham,Leave it wif me lar... ÌÏ wan to carry meh so heavy... Is da num 98321561 familiar to Ì_?,89,19,7,leav wif lar ìï wan carri meh heavi da num familiar ì,53
ham,Beautiful truth : Expression of the face could Be seen by everyone... But the depression of heart Could be understood only By the Loved ones.. Gud Ni8;-),153,27,6,beauti truth express face could seen everyon depress heart could understood love one gud ni,91
ham,Infact happy new year. How are you where are you when are we seeing,67,14,2,infact happi new year see,25
spam,"In The Simpsons Movie released in July 2007 name the band that died at the start of the film? A-Green Day, B-Blue Day, C-Red Day. (Send A, B or C)",146,30,2,simpson movi releas juli name band die start film agreen day bblue day cred day send b c,88
ham,That's a shame! Maybe cld meet for few hrs tomo?,48,10,1,that shame mayb cld meet hr tomo,32
ham,Lol I would but despite these cramps I like being a girl.,57,12,2,lol would despit cramp like girl,32
ham,I canåÕt wait for cornwall. Hope tonight isnåÕt too bad as well but itåÕs rock night shite. Anyway iåÕm going for a kip now have a good night. Speak to you soon.,161,32,5,canåõt wait cornwal hope tonight isnåõt bad well itåõ rock night shite anyway iåõm go kip good night speak soon,111
ham,Pls help me tell sura that i'm expecting a battery from hont. And that if should pls send me a message about how to download movies. Thanks,139,27,3,pl help tell sura im expect batteri hont pl send messag download movi thank,75
spam,Please call Amanda with regard to renewing or upgrading your current T-Mobile handset free of charge. Offer ends today. Tel 0845 021 3680 subject to T's and C's,160,28,3,pleas call amanda regard renew upgrad current tmobil handset free charg offer end today tel subject ts cs,105
ham,"Haven't found a way to get another app for your phone, eh ? Will you go to the net cafe ? Did you take that job? Geeee I need you babe. I crave to see you ...",158,37,5,havent found way get anoth app phone eh go net cafe take job geeee need babe crave see,86
ham,I only work from mon to thurs but Sat i cant leh... Booked liao... Which other day u free?,90,19,7,work mon thur sat cant leh book liao day u free,47
ham,ÌÏ comin to fetch us oredi...,29,6,4,ìï comin fetch us oredi,23
ham,What's nannys address?,22,3,1,what nanni address,18
ham,Haf u eaten? Wat time u wan me 2 come?,38,10,1,haf u eaten wat time u wan come,31
spam,Want a new Video Phone? 750 anytime any network mins? Half price line rental free text for 3 months? Reply or call 08000930705 for free delivery,144,26,1,want new video phone anytim network min half price line rental free text month repli call free deliveri,103
ham,"Yo, call me when you get the chance, a friend of mine wanted me to ask you about a big order",92,21,1,yo call get chanc friend mine want ask big order,48
ham,This single single answers are we fighting? Plus i said am broke and you didnt reply,84,16,1,singl singl answer fight plu said broke didnt repli,51
ham,It certainly puts things into perspective when something like this happens,74,11,1,certainli put thing perspect someth like happen,47
ham,Now got tv 2 watch meh? U no work today?,40,10,1,got tv watch meh u work today,29
ham,i felt so...not any conveying reason.. Ese he... What about me?,63,11,9,felt sonot convey reason ese,28
ham,How's it going? Got any exciting karaoke type activities planned? I'm debating whether to play football this eve. Feeling lazy though.,134,21,3,how go got excit karaok type activ plan im debat whether play footbal eve feel lazi though,90
ham,I told that am coming on wednesday.,35,7,2,told come wednesday,19
